id,email,password_salt,password_hashed,first_name,last_name,nickname,birthday,avatar,intro,gender,occupation
126,smackowle3h@cbslocal.com,c7c5412a99926be2a9b4d8b2906a9f0e,ec5b298177b660f06082f6e51bcf449d5c2ff906f022b816beb5c21ffdc9c28e,Saul,MacKowle,smackowle3h,1976-07-02,https://i.imgur.com/0avxl7q.jpg,"Nam dui. Proin leo odio, porttitor id, consequat in, consequat ut, nulla. Sed accumsan felis. Ut at dolor quis odio consequat varius. Integer ac leo.",1,Data Coordiator
129,tjerome3k@biblegateway.com,c7c5412a99926be2a9b4d8b2906a9f0e,ec5b298177b660f06082f6e51bcf449d5c2ff906f022b816beb5c21ffdc9c28e,Thibaud,Jerome,tjerome3k,1972-12-22,https://i.imgur.com/0avxl7q.jpg,"Pellentesque eget nunc. Donec quis orci eget orci vehicula condimentum. Curabitur in libero ut massa volutpat convallis. Morbi odio odio, elementum eu, interdum eu, tincidunt in, leo. Maecenas pulvinar lobortis est. Phasellus sit amet erat.",1,Business Systems Development Analyst
130,wmclurg3l@plala.or.jp,c7c5412a99926be2a9b4d8b2906a9f0e,ec5b298177b660f06082f6e51bcf449d5c2ff906f022b816beb5c21ffdc9c28e,Wake,McLurg,wmclurg3l,1957-11-01,https://i.imgur.com/0avxl7q.jpg,Mauris lacinia sapien quis libero. Nullam sit amet turpis elementum ligula vehicula consequat. Morbi a ipsum.,1,Administrative Assistant IV
131,wwoolward3m@chicagotribune.com,c7c5412a99926be2a9b4d8b2906a9f0e,ec5b298177b660f06082f6e51bcf449d5c2ff906f022b816beb5c21ffdc9c28e,Wyatan,Woolward,wwoolward3m,1999-01-17,https://i.imgur.com/0avxl7q.jpg,"Morbi quis tortor id nulla ultrices aliquet. Maecenas leo odio, condimentum id, luctus nec, molestie sed, justo. Pellentesque viverra pede ac diam. Cras pellentesque volutpat dui. Maecenas tristique, est et tempus semper, est quam pharetra magna, ac consequat metus sapien ut nunc. Vestibulum ante ipsum primis in faucibus orci luctus et ultrices posuere cubilia Curae; Mauris viverra diam vitae quam.",1,Human Resources Assistant III
148,edoerren43@yelp.com,c7c5412a99926be2a9b4d8b2906a9f0e,ec5b298177b660f06082f6e51bcf449d5c2ff906f022b816beb5c21ffdc9c28e,Ervin,Doerren,edoerren43,1987-03-18,https://i.imgur.com/0avxl7q.jpg,"In hac habitasse platea dictumst. Aliquam augue quam, sollicitudin vitae, consectetuer eget, rutrum at, lorem. Integer tincidunt ante vel ipsum.",1,Clinical Specialist
134,bmquharge3p@networkadvertising.org,c7c5412a99926be2a9b4d8b2906a9f0e,ec5b298177b660f06082f6e51bcf449d5c2ff906f022b816beb5c21ffdc9c28e,Brantley,M'Quharge,bmquharge3p,1984-09-29,https://i.imgur.com/0avxl7q.jpg,"Nullam porttitor lacus at turpis. Donec posuere metus vitae ipsum. Aliquam non mauris. Morbi non lectus. Aliquam sit amet diam in magna bibendum imperdiet. Nullam orci pede, venenatis non, sodales sed, tincidunt eu, felis. Fusce posuere felis sed lacus.",1,Pharmacist
135,tphelipeau3q@elpais.com,c7c5412a99926be2a9b4d8b2906a9f0e,ec5b298177b660f06082f6e51bcf449d5c2ff906f022b816beb5c21ffdc9c28e,Tab,Phelipeau,tphelipeau3q,1967-07-28,https://i.imgur.com/0avxl7q.jpg,"Lorem ipsum dolor sit amet, consectetuer adipiscing elit. Proin risus. Praesent lectus. Vestibulum quam sapien, varius ut, blandit non, interdum in, ante. Vestibulum ante ipsum primis in faucibus orci luctus et ultrices posuere cubilia Curae; Duis faucibus accumsan odio. Curabitur convallis. Duis consequat dui nec nisi volutpat eleifend.",1,Programmer IV
138,zslinn3t@github.io,c7c5412a99926be2a9b4d8b2906a9f0e,ec5b298177b660f06082f6e51bcf449d5c2ff906f022b816beb5c21ffdc9c28e,Zedekiah,Slinn,zslinn3t,1992-06-12,https://i.imgur.com/0avxl7q.jpg,"Nullam porttitor lacus at turpis. Donec posuere metus vitae ipsum. Aliquam non mauris. Morbi non lectus. Aliquam sit amet diam in magna bibendum imperdiet. Nullam orci pede, venenatis non, sodales sed, tincidunt eu, felis. Fusce posuere felis sed lacus.",1,Legal Assistant
141,atuckley3w@meetup.com,c7c5412a99926be2a9b4d8b2906a9f0e,ec5b298177b660f06082f6e51bcf449d5c2ff906f022b816beb5c21ffdc9c28e,Alexandr,Tuckley,atuckley3w,1979-11-18,https://i.imgur.com/0avxl7q.jpg,"Nunc rhoncus dui vel sem. Sed sagittis. Nam congue, risus semper porta volutpat, quam pede lobortis ligula, sit amet eleifend pede libero quis orci. Nullam molestie nibh in lectus.",1,Director of Sales
142,efellenor3x@abc.net.au,c7c5412a99926be2a9b4d8b2906a9f0e,ec5b298177b660f06082f6e51bcf449d5c2ff906f022b816beb5c21ffdc9c28e,Elmore,Fellenor,efellenor3x,1957-04-05,https://i.imgur.com/0avxl7q.jpg,In eleifend quam a odio. In hac habitasse platea dictumst. Maecenas ut massa quis augue luctus tincidunt. Nulla mollis molestie lorem. Quisque ut erat. Curabitur gravida nisi at nibh. In hac habitasse platea dictumst.,1,Developer II
143,ppirrey3y@nifty.com,c7c5412a99926be2a9b4d8b2906a9f0e,ec5b298177b660f06082f6e51bcf449d5c2ff906f022b816beb5c21ffdc9c28e,Pren,Pirrey,ppirrey3y,1984-04-17,https://i.imgur.com/0avxl7q.jpg,"Maecenas tristique, est et tempus semper, est quam pharetra magna, ac consequat metus sapien ut nunc. Vestibulum ante ipsum primis in faucibus orci luctus et ultrices posuere cubilia Curae; Mauris viverra diam vitae quam. Suspendisse potenti. Nullam porttitor lacus at turpis.",1,Sales Associate
147,veilhersen42@odnoklassniki.ru,c7c5412a99926be2a9b4d8b2906a9f0e,ec5b298177b660f06082f6e51bcf449d5c2ff906f022b816beb5c21ffdc9c28e,Val,Eilhersen,veilhersen42,1983-03-14,https://i.imgur.com/0avxl7q.jpg,Ut at dolor quis odio consequat varius. Integer ac leo. Pellentesque ultrices mattis odio.,1,Quality Control Specialist
149,cmcateer44@vimeo.com,c7c5412a99926be2a9b4d8b2906a9f0e,ec5b298177b660f06082f6e51bcf449d5c2ff906f022b816beb5c21ffdc9c28e,Constantine,McAteer,cmcateer44,1969-07-23,https://i.imgur.com/0avxl7q.jpg,"Morbi sem mauris, laoreet ut, rhoncus aliquet, pulvinar sed, nisl. Nunc rhoncus dui vel sem. Sed sagittis. Nam congue, risus semper porta volutpat, quam pede lobortis ligula, sit amet eleifend pede libero quis orci. Nullam molestie nibh in lectus. Pellentesque at nulla.",1,Quality Engineer
150,sruseworth45@google.co.jp,c7c5412a99926be2a9b4d8b2906a9f0e,ec5b298177b660f06082f6e51bcf449d5c2ff906f022b816beb5c21ffdc9c28e,Seumas,Ruseworth,sruseworth45,1985-06-17,https://i.imgur.com/0avxl7q.jpg,"Cum sociis natoque penatibus et magnis dis parturient montes, nascetur ridiculus mus. Etiam vel augue. Vestibulum rutrum rutrum neque.",1,Environmental Specialist
152,dtraite47@clickbank.net,c7c5412a99926be2a9b4d8b2906a9f0e,ec5b298177b660f06082f6e51bcf449d5c2ff906f022b816beb5c21ffdc9c28e,Dun,Traite,dtraite47,1989-09-21,https://i.imgur.com/0avxl7q.jpg,"Donec odio justo, sollicitudin ut, suscipit a, feugiat et, eros. Vestibulum ac est lacinia nisi venenatis tristique. Fusce congue, diam id ornare imperdiet, sapien urna pretium nisl, ut volutpat sapien arcu sed augue. Aliquam erat volutpat.",1,Physical Therapy Assistant
153,twerrit48@unesco.org,c7c5412a99926be2a9b4d8b2906a9f0e,ec5b298177b660f06082f6e51bcf449d5c2ff906f022b816beb5c21ffdc9c28e,Thane,Werrit,twerrit48,1989-07-02,https://i.imgur.com/0avxl7q.jpg,"Fusce posuere felis sed lacus. Morbi sem mauris, laoreet ut, rhoncus aliquet, pulvinar sed, nisl. Nunc rhoncus dui vel sem. Sed sagittis. Nam congue, risus semper porta volutpat, quam pede lobortis ligula, sit amet eleifend pede libero quis orci. Nullam molestie nibh in lectus.",1,Senior Developer
155,mkearle4a@google.co.jp,c7c5412a99926be2a9b4d8b2906a9f0e,ec5b298177b660f06082f6e51bcf449d5c2ff906f022b816beb5c21ffdc9c28e,Mano,Kearle,mkearle4a,2000-09-17,https://i.imgur.com/0avxl7q.jpg,"Proin risus. Praesent lectus. Vestibulum quam sapien, varius ut, blandit non, interdum in, ante.",1,Social Worker
210,gstreetley5t@twitpic.com,c7c5412a99926be2a9b4d8b2906a9f0e,ec5b298177b660f06082f6e51bcf449d5c2ff906f022b816beb5c21ffdc9c28e,Gunter,Streetley,gstreetley5t,1974-03-19,https://i.imgur.com/0avxl7q.jpg,"Nulla neque libero, convallis eget, eleifend luctus, ultricies eu, nibh. Quisque id justo sit amet sapien dignissim vestibulum. Vestibulum ante ipsum primis in faucibus orci luctus et ultrices posuere cubilia Curae; Nulla dapibus dolor vel est.",1,Social Worker
157,twhanstall4c@wufoo.com,c7c5412a99926be2a9b4d8b2906a9f0e,ec5b298177b660f06082f6e51bcf449d5c2ff906f022b816beb5c21ffdc9c28e,Tiebold,Whanstall,twhanstall4c,1997-06-21,https://i.imgur.com/0avxl7q.jpg,"Nulla mollis molestie lorem. Quisque ut erat. Curabitur gravida nisi at nibh. In hac habitasse platea dictumst. Aliquam augue quam, sollicitudin vitae, consectetuer eget, rutrum at, lorem.",1,Chemical Engineer
158,rtrout4d@bigcartel.com,c7c5412a99926be2a9b4d8b2906a9f0e,ec5b298177b660f06082f6e51bcf449d5c2ff906f022b816beb5c21ffdc9c28e,Reagan,Trout,rtrout4d,1965-10-20,https://i.imgur.com/0avxl7q.jpg,"Cum sociis natoque penatibus et magnis dis parturient montes, nascetur ridiculus mus. Vivamus vestibulum sagittis sapien. Cum sociis natoque penatibus et magnis dis parturient montes, nascetur ridiculus mus. Etiam vel augue. Vestibulum rutrum rutrum neque. Aenean auctor gravida sem. Praesent id massa id nisl venenatis lacinia. Aenean sit amet justo.",1,Nuclear Power Engineer
159,ddinsmore4e@buzzfeed.com,c7c5412a99926be2a9b4d8b2906a9f0e,ec5b298177b660f06082f6e51bcf449d5c2ff906f022b816beb5c21ffdc9c28e,Davin,Dinsmore,ddinsmore4e,1985-04-21,https://i.imgur.com/0avxl7q.jpg,Mauris lacinia sapien quis libero. Nullam sit amet turpis elementum ligula vehicula consequat. Morbi a ipsum. Integer a nibh.,1,Software Consultant
160,abarabich4f@indiegogo.com,c7c5412a99926be2a9b4d8b2906a9f0e,ec5b298177b660f06082f6e51bcf449d5c2ff906f022b816beb5c21ffdc9c28e,Arte,Barabich,abarabich4f,1963-04-03,https://i.imgur.com/0avxl7q.jpg,"Aliquam sit amet diam in magna bibendum imperdiet. Nullam orci pede, venenatis non, sodales sed, tincidunt eu, felis. Fusce posuere felis sed lacus. Morbi sem mauris, laoreet ut, rhoncus aliquet, pulvinar sed, nisl. Nunc rhoncus dui vel sem.",1,Chief Design Engineer
162,ndegrey4h@nsw.gov.au,c7c5412a99926be2a9b4d8b2906a9f0e,ec5b298177b660f06082f6e51bcf449d5c2ff906f022b816beb5c21ffdc9c28e,Norry,de Grey,ndegrey4h,1991-03-12,https://i.imgur.com/0avxl7q.jpg,"Morbi non quam nec dui luctus rutrum. Nulla tellus. In sagittis dui vel nisl. Duis ac nibh. Fusce lacus purus, aliquet at, feugiat non, pretium quis, lectus. Suspendisse potenti. In eleifend quam a odio. In hac habitasse platea dictumst.",1,Help Desk Technician
164,bionn4j@amazon.co.jp,c7c5412a99926be2a9b4d8b2906a9f0e,ec5b298177b660f06082f6e51bcf449d5c2ff906f022b816beb5c21ffdc9c28e,Beauregard,Ionn,bionn4j,1976-12-05,https://i.imgur.com/0avxl7q.jpg,"Proin risus. Praesent lectus. Vestibulum quam sapien, varius ut, blandit non, interdum in, ante. Vestibulum ante ipsum primis in faucibus orci luctus et ultrices posuere cubilia Curae; Duis faucibus accumsan odio. Curabitur convallis.",1,Office Assistant I
171,wfavill4q@sciencedirect.com,c7c5412a99926be2a9b4d8b2906a9f0e,ec5b298177b660f06082f6e51bcf449d5c2ff906f022b816beb5c21ffdc9c28e,Walsh,Favill,wfavill4q,1982-12-06,https://i.imgur.com/0avxl7q.jpg,"Maecenas pulvinar lobortis est. Phasellus sit amet erat. Nulla tempus. Vivamus in felis eu sapien cursus vestibulum. Proin eu mi. Nulla ac enim. In tempor, turpis nec euismod scelerisque, quam turpis adipiscing lorem, vitae mattis nibh ligula nec sem. Duis aliquam convallis nunc.",1,Pharmacist
172,esteljes4r@accuweather.com,c7c5412a99926be2a9b4d8b2906a9f0e,ec5b298177b660f06082f6e51bcf449d5c2ff906f022b816beb5c21ffdc9c28e,Ewart,Steljes,esteljes4r,1999-06-21,https://i.imgur.com/0avxl7q.jpg,"Maecenas leo odio, condimentum id, luctus nec, molestie sed, justo. Pellentesque viverra pede ac diam. Cras pellentesque volutpat dui. Maecenas tristique, est et tempus semper, est quam pharetra magna, ac consequat metus sapien ut nunc. Vestibulum ante ipsum primis in faucibus orci luctus et ultrices posuere cubilia Curae; Mauris viverra diam vitae quam. Suspendisse potenti.",1,Actuary
173,ddalston4s@oracle.com,c7c5412a99926be2a9b4d8b2906a9f0e,ec5b298177b660f06082f6e51bcf449d5c2ff906f022b816beb5c21ffdc9c28e,Derwin,Dalston,ddalston4s,1959-09-06,https://i.imgur.com/0avxl7q.jpg,"Praesent blandit lacinia erat. Vestibulum sed magna at nunc commodo placerat. Praesent blandit. Nam nulla. Integer pede justo, lacinia eget, tincidunt eget, tempus vel, pede.",1,Software Consultant
174,shallgate4t@netvibes.com,c7c5412a99926be2a9b4d8b2906a9f0e,ec5b298177b660f06082f6e51bcf449d5c2ff906f022b816beb5c21ffdc9c28e,Swen,Hallgate,shallgate4t,1969-06-13,https://i.imgur.com/0avxl7q.jpg,"Morbi non lectus. Aliquam sit amet diam in magna bibendum imperdiet. Nullam orci pede, venenatis non, sodales sed, tincidunt eu, felis. Fusce posuere felis sed lacus. Morbi sem mauris, laoreet ut, rhoncus aliquet, pulvinar sed, nisl. Nunc rhoncus dui vel sem.",1,Cost Accountant
181,mcahalin50@networkadvertising.org,c7c5412a99926be2a9b4d8b2906a9f0e,ec5b298177b660f06082f6e51bcf449d5c2ff906f022b816beb5c21ffdc9c28e,Morty,Cahalin,mcahalin50,1966-04-13,https://i.imgur.com/0avxl7q.jpg,"Morbi porttitor lorem id ligula. Suspendisse ornare consequat lectus. In est risus, auctor sed, tristique in, tempus sit amet, sem. Fusce consequat. Nulla nisl. Nunc nisl.",1,Computer Systems Analyst III
184,hsappell53@tamu.edu,c7c5412a99926be2a9b4d8b2906a9f0e,ec5b298177b660f06082f6e51bcf449d5c2ff906f022b816beb5c21ffdc9c28e,Hasheem,Sappell,hsappell53,1953-06-26,https://i.imgur.com/0avxl7q.jpg,Nullam varius. Nulla facilisi. Cras non velit nec nisi vulputate nonummy.,1,Accountant IV
185,ncleare54@typepad.com,c7c5412a99926be2a9b4d8b2906a9f0e,ec5b298177b660f06082f6e51bcf449d5c2ff906f022b816beb5c21ffdc9c28e,Norman,Cleare,ncleare54,1965-11-09,https://i.imgur.com/0avxl7q.jpg,"Donec dapibus. Duis at velit eu est congue elementum. In hac habitasse platea dictumst. Morbi vestibulum, velit id pretium iaculis, diam erat fermentum justo, nec condimentum neque sapien placerat ante. Nulla justo.",1,Senior Editor
194,ajudron5d@slideshare.net,c7c5412a99926be2a9b4d8b2906a9f0e,ec5b298177b660f06082f6e51bcf449d5c2ff906f022b816beb5c21ffdc9c28e,Albrecht,Judron,ajudron5d,1968-02-15,https://i.imgur.com/0avxl7q.jpg,"Cras pellentesque volutpat dui. Maecenas tristique, est et tempus semper, est quam pharetra magna, ac consequat metus sapien ut nunc. Vestibulum ante ipsum primis in faucibus orci luctus et ultrices posuere cubilia Curae; Mauris viverra diam vitae quam. Suspendisse potenti. Nullam porttitor lacus at turpis. Donec posuere metus vitae ipsum. Aliquam non mauris. Morbi non lectus.",1,Help Desk Operator
196,hborsay5f@newyorker.com,c7c5412a99926be2a9b4d8b2906a9f0e,ec5b298177b660f06082f6e51bcf449d5c2ff906f022b816beb5c21ffdc9c28e,Hagen,Borsay,hborsay5f,1985-08-10,https://i.imgur.com/0avxl7q.jpg,"Nulla tellus. In sagittis dui vel nisl. Duis ac nibh. Fusce lacus purus, aliquet at, feugiat non, pretium quis, lectus. Suspendisse potenti. In eleifend quam a odio.",1,Registered Nurse
197,tadamo5g@cnbc.com,c7c5412a99926be2a9b4d8b2906a9f0e,ec5b298177b660f06082f6e51bcf449d5c2ff906f022b816beb5c21ffdc9c28e,Tommie,Adamo,tadamo5g,1981-03-07,https://i.imgur.com/0avxl7q.jpg,"Fusce congue, diam id ornare imperdiet, sapien urna pretium nisl, ut volutpat sapien arcu sed augue. Aliquam erat volutpat. In congue.",1,Chief Design Engineer
199,ebartosinski5i@nationalgeographic.com,c7c5412a99926be2a9b4d8b2906a9f0e,ec5b298177b660f06082f6e51bcf449d5c2ff906f022b816beb5c21ffdc9c28e,Ed,Bartosinski,ebartosinski5i,1953-04-02,https://i.imgur.com/0avxl7q.jpg,"Cras non velit nec nisi vulputate nonummy. Maecenas tincidunt lacus at velit. Vivamus vel nulla eget eros elementum pellentesque. Quisque porta volutpat erat. Quisque erat eros, viverra eget, congue eget, semper rutrum, nulla. Nunc purus. Phasellus in felis. Donec semper sapien a libero.",1,Physical Therapy Assistant
200,kwatts5j@admin.ch,c7c5412a99926be2a9b4d8b2906a9f0e,ec5b298177b660f06082f6e51bcf449d5c2ff906f022b816beb5c21ffdc9c28e,Kerry,Watts,kwatts5j,1997-07-02,https://i.imgur.com/0avxl7q.jpg,"Quisque ut erat. Curabitur gravida nisi at nibh. In hac habitasse platea dictumst. Aliquam augue quam, sollicitudin vitae, consectetuer eget, rutrum at, lorem. Integer tincidunt ante vel ipsum.",1,Geological Engineer
202,nsnuggs5l@dyndns.org,c7c5412a99926be2a9b4d8b2906a9f0e,ec5b298177b660f06082f6e51bcf449d5c2ff906f022b816beb5c21ffdc9c28e,Nicola,Snuggs,nsnuggs5l,1964-07-18,https://i.imgur.com/0avxl7q.jpg,"Integer non velit. Donec diam neque, vestibulum eget, vulputate ut, ultrices vel, augue. Vestibulum ante ipsum primis in faucibus orci luctus et ultrices posuere cubilia Curae; Donec pharetra, magna vestibulum aliquet ultrices, erat tortor sollicitudin mi, sit amet lobortis sapien sapien non mi. Integer ac neque. Duis bibendum. Morbi non quam nec dui luctus rutrum.",1,Technical Writer
205,tbucknill5o@google.co.uk,c7c5412a99926be2a9b4d8b2906a9f0e,ec5b298177b660f06082f6e51bcf449d5c2ff906f022b816beb5c21ffdc9c28e,Tynan,Bucknill,tbucknill5o,1966-12-13,https://i.imgur.com/0avxl7q.jpg,"Morbi vestibulum, velit id pretium iaculis, diam erat fermentum justo, nec condimentum neque sapien placerat ante. Nulla justo. Aliquam quis turpis eget elit sodales scelerisque. Mauris sit amet eros. Suspendisse accumsan tortor quis turpis. Sed ante. Vivamus tortor.",1,Dental Hygienist
206,nthreadkell5p@naver.com,c7c5412a99926be2a9b4d8b2906a9f0e,ec5b298177b660f06082f6e51bcf449d5c2ff906f022b816beb5c21ffdc9c28e,Nikki,Threadkell,nthreadkell5p,1981-04-16,https://i.imgur.com/0avxl7q.jpg,"Phasellus id sapien in sapien iaculis congue. Vivamus metus arcu, adipiscing molestie, hendrerit at, vulputate vitae, nisl. Aenean lectus. Pellentesque eget nunc. Donec quis orci eget orci vehicula condimentum. Curabitur in libero ut massa volutpat convallis. Morbi odio odio, elementum eu, interdum eu, tincidunt in, leo. Maecenas pulvinar lobortis est.",1,Computer Systems Analyst I
207,wcoslitt5q@studiopress.com,c7c5412a99926be2a9b4d8b2906a9f0e,ec5b298177b660f06082f6e51bcf449d5c2ff906f022b816beb5c21ffdc9c28e,Warner,Coslitt,wcoslitt5q,1957-12-29,https://i.imgur.com/0avxl7q.jpg,Sed vel enim sit amet nunc viverra dapibus. Nulla suscipit ligula in lacus. Curabitur at ipsum ac tellus semper interdum.,1,Director of Sales
211,gblevin5u@meetup.com,c7c5412a99926be2a9b4d8b2906a9f0e,ec5b298177b660f06082f6e51bcf449d5c2ff906f022b816beb5c21ffdc9c28e,Grove,Blevin,gblevin5u,1994-07-31,https://i.imgur.com/0avxl7q.jpg,"Etiam vel augue. Vestibulum rutrum rutrum neque. Aenean auctor gravida sem. Praesent id massa id nisl venenatis lacinia. Aenean sit amet justo. Morbi ut odio. Cras mi pede, malesuada in, imperdiet et, commodo vulputate, justo.",1,Database Administrator III
212,kcouve5v@technorati.com,c7c5412a99926be2a9b4d8b2906a9f0e,ec5b298177b660f06082f6e51bcf449d5c2ff906f022b816beb5c21ffdc9c28e,Korey,Couve,kcouve5v,1993-12-02,https://i.imgur.com/0avxl7q.jpg,Nulla tempus. Vivamus in felis eu sapien cursus vestibulum. Proin eu mi.,1,Senior Cost Accountant
213,lphippard5w@cdc.gov,c7c5412a99926be2a9b4d8b2906a9f0e,ec5b298177b660f06082f6e51bcf449d5c2ff906f022b816beb5c21ffdc9c28e,Lothaire,Phippard,lphippard5w,1979-11-05,https://i.imgur.com/0avxl7q.jpg,"Duis bibendum. Morbi non quam nec dui luctus rutrum. Nulla tellus. In sagittis dui vel nisl. Duis ac nibh. Fusce lacus purus, aliquet at, feugiat non, pretium quis, lectus. Suspendisse potenti.",1,Administrative Assistant III
218,sglason61@soup.io,c7c5412a99926be2a9b4d8b2906a9f0e,ec5b298177b660f06082f6e51bcf449d5c2ff906f022b816beb5c21ffdc9c28e,Sigismond,Glason,sglason61,1994-09-12,https://i.imgur.com/0avxl7q.jpg,Integer ac neque. Duis bibendum. Morbi non quam nec dui luctus rutrum. Nulla tellus. In sagittis dui vel nisl.,1,Marketing Assistant
220,squarrell63@yandex.ru,c7c5412a99926be2a9b4d8b2906a9f0e,ec5b298177b660f06082f6e51bcf449d5c2ff906f022b816beb5c21ffdc9c28e,Spenser,Quarrell,squarrell63,1981-06-04,https://i.imgur.com/0avxl7q.jpg,"Vivamus in felis eu sapien cursus vestibulum. Proin eu mi. Nulla ac enim. In tempor, turpis nec euismod scelerisque, quam turpis adipiscing lorem, vitae mattis nibh ligula nec sem. Duis aliquam convallis nunc. Proin at turpis a pede posuere nonummy. Integer non velit. Donec diam neque, vestibulum eget, vulputate ut, ultrices vel, augue.",1,Internal Auditor
221,mcrossby64@issuu.com,c7c5412a99926be2a9b4d8b2906a9f0e,ec5b298177b660f06082f6e51bcf449d5c2ff906f022b816beb5c21ffdc9c28e,Morton,Crossby,mcrossby64,1992-04-12,https://i.imgur.com/0avxl7q.jpg,"Duis bibendum. Morbi non quam nec dui luctus rutrum. Nulla tellus. In sagittis dui vel nisl. Duis ac nibh. Fusce lacus purus, aliquet at, feugiat non, pretium quis, lectus.",1,Account Coordinator
222,bwilfinger65@redcross.org,c7c5412a99926be2a9b4d8b2906a9f0e,ec5b298177b660f06082f6e51bcf449d5c2ff906f022b816beb5c21ffdc9c28e,Byrann,Wilfinger,bwilfinger65,1963-10-13,https://i.imgur.com/0avxl7q.jpg,Etiam faucibus cursus urna. Ut tellus. Nulla ut erat id mauris vulputate elementum. Nullam varius. Nulla facilisi. Cras non velit nec nisi vulputate nonummy. Maecenas tincidunt lacus at velit. Vivamus vel nulla eget eros elementum pellentesque.,1,Marketing Assistant
223,kcamies66@sourceforge.net,c7c5412a99926be2a9b4d8b2906a9f0e,ec5b298177b660f06082f6e51bcf449d5c2ff906f022b816beb5c21ffdc9c28e,Kalvin,Camies,kcamies66,1955-05-03,https://i.imgur.com/0avxl7q.jpg,"Proin risus. Praesent lectus. Vestibulum quam sapien, varius ut, blandit non, interdum in, ante. Vestibulum ante ipsum primis in faucibus orci luctus et ultrices posuere cubilia Curae; Duis faucibus accumsan odio. Curabitur convallis. Duis consequat dui nec nisi volutpat eleifend. Donec ut dolor.",1,Help Desk Technician
228,tratchford6b@nasa.gov,c7c5412a99926be2a9b4d8b2906a9f0e,ec5b298177b660f06082f6e51bcf449d5c2ff906f022b816beb5c21ffdc9c28e,Terri,Ratchford,tratchford6b,1978-04-22,https://i.imgur.com/0avxl7q.jpg,Nulla justo. Aliquam quis turpis eget elit sodales scelerisque. Mauris sit amet eros. Suspendisse accumsan tortor quis turpis.,1,Financial Analyst
230,nmacgibbon6d@google.com.br,c7c5412a99926be2a9b4d8b2906a9f0e,ec5b298177b660f06082f6e51bcf449d5c2ff906f022b816beb5c21ffdc9c28e,Nolly,MacGibbon,nmacgibbon6d,1965-05-31,https://i.imgur.com/0avxl7q.jpg,Suspendisse potenti. In eleifend quam a odio. In hac habitasse platea dictumst. Maecenas ut massa quis augue luctus tincidunt. Nulla mollis molestie lorem. Quisque ut erat. Curabitur gravida nisi at nibh. In hac habitasse platea dictumst.,1,Recruiter
231,jnise6e@usda.gov,c7c5412a99926be2a9b4d8b2906a9f0e,ec5b298177b660f06082f6e51bcf449d5c2ff906f022b816beb5c21ffdc9c28e,Johnny,Nise,jnise6e,1975-09-27,https://i.imgur.com/0avxl7q.jpg,"Duis aliquam convallis nunc. Proin at turpis a pede posuere nonummy. Integer non velit. Donec diam neque, vestibulum eget, vulputate ut, ultrices vel, augue. Vestibulum ante ipsum primis in faucibus orci luctus et ultrices posuere cubilia Curae; Donec pharetra, magna vestibulum aliquet ultrices, erat tortor sollicitudin mi, sit amet lobortis sapien sapien non mi.",1,Dental Hygienist
232,apoulson6f@scientificamerican.com,c7c5412a99926be2a9b4d8b2906a9f0e,ec5b298177b660f06082f6e51bcf449d5c2ff906f022b816beb5c21ffdc9c28e,Arv,Poulson,apoulson6f,1978-09-20,https://i.imgur.com/0avxl7q.jpg,Aenean auctor gravida sem. Praesent id massa id nisl venenatis lacinia. Aenean sit amet justo.,1,Graphic Designer
233,hburling6g@slashdot.org,c7c5412a99926be2a9b4d8b2906a9f0e,ec5b298177b660f06082f6e51bcf449d5c2ff906f022b816beb5c21ffdc9c28e,Hank,Burling,hburling6g,1961-04-09,https://i.imgur.com/0avxl7q.jpg,"Morbi quis tortor id nulla ultrices aliquet. Maecenas leo odio, condimentum id, luctus nec, molestie sed, justo. Pellentesque viverra pede ac diam. Cras pellentesque volutpat dui. Maecenas tristique, est et tempus semper, est quam pharetra magna, ac consequat metus sapien ut nunc. Vestibulum ante ipsum primis in faucibus orci luctus et ultrices posuere cubilia Curae; Mauris viverra diam vitae quam. Suspendisse potenti.",1,Office Assistant III
270,dcrome7h@cafepress.com,c7c5412a99926be2a9b4d8b2906a9f0e,ec5b298177b660f06082f6e51bcf449d5c2ff906f022b816beb5c21ffdc9c28e,Doug,Crome,dcrome7h,1995-12-19,https://i.imgur.com/0avxl7q.jpg,"Phasellus id sapien in sapien iaculis congue. Vivamus metus arcu, adipiscing molestie, hendrerit at, vulputate vitae, nisl. Aenean lectus.",1,Web Developer II
234,gkamen6h@jugem.jp,c7c5412a99926be2a9b4d8b2906a9f0e,ec5b298177b660f06082f6e51bcf449d5c2ff906f022b816beb5c21ffdc9c28e,Gib,Kamen,gkamen6h,1995-02-28,https://i.imgur.com/0avxl7q.jpg,"Duis aliquam convallis nunc. Proin at turpis a pede posuere nonummy. Integer non velit. Donec diam neque, vestibulum eget, vulputate ut, ultrices vel, augue. Vestibulum ante ipsum primis in faucibus orci luctus et ultrices posuere cubilia Curae; Donec pharetra, magna vestibulum aliquet ultrices, erat tortor sollicitudin mi, sit amet lobortis sapien sapien non mi. Integer ac neque. Duis bibendum.",1,Internal Auditor
236,kglison6j@acquirethisname.com,c7c5412a99926be2a9b4d8b2906a9f0e,ec5b298177b660f06082f6e51bcf449d5c2ff906f022b816beb5c21ffdc9c28e,Kilian,Glison,kglison6j,1995-03-06,https://i.imgur.com/0avxl7q.jpg,Etiam pretium iaculis justo. In hac habitasse platea dictumst. Etiam faucibus cursus urna. Ut tellus. Nulla ut erat id mauris vulputate elementum. Nullam varius. Nulla facilisi.,1,Assistant Professor
238,kpieroni6l@woothemes.com,c7c5412a99926be2a9b4d8b2906a9f0e,ec5b298177b660f06082f6e51bcf449d5c2ff906f022b816beb5c21ffdc9c28e,Karl,Pieroni,kpieroni6l,1957-11-20,https://i.imgur.com/0avxl7q.jpg,"Nulla tellus. In sagittis dui vel nisl. Duis ac nibh. Fusce lacus purus, aliquet at, feugiat non, pretium quis, lectus. Suspendisse potenti. In eleifend quam a odio. In hac habitasse platea dictumst. Maecenas ut massa quis augue luctus tincidunt.",1,Human Resources Manager
