id,email,password_salt,password_hashed,first_name,last_name,nickname,birthday,avatar,intro,gender,occupation
691,mlabbetj6@icq.com,c7c5412a99926be2a9b4d8b2906a9f0e,ec5b298177b660f06082f6e51bcf449d5c2ff906f022b816beb5c21ffdc9c28e,Maddie,LAbbet,mlabbetj6,1999-04-04,https://i.imgur.com/0avxl7q.jpg,"Donec ut dolor. Morbi vel lectus in quam fringilla rhoncus. Mauris enim leo, rhoncus sed, vestibulum sit amet, cursus id, turpis. Integer aliquet, massa id lobortis convallis, tortor risus dapibus augue, vel accumsan tellus nisi eu orci. Mauris lacinia sapien quis libero. Nullam sit amet turpis elementum ligula vehicula consequat. Morbi a ipsum.",1,Nuclear Power Engineer
694,kbasirej9@lycos.com,c7c5412a99926be2a9b4d8b2906a9f0e,ec5b298177b660f06082f6e51bcf449d5c2ff906f022b816beb5c21ffdc9c28e,Kayne,Basire,kbasirej9,1989-05-18,https://i.imgur.com/0avxl7q.jpg,"Duis bibendum, felis sed interdum venenatis, turpis enim blandit mi, in porttitor pede justo eu massa. Donec dapibus. Duis at velit eu est congue elementum. In hac habitasse platea dictumst. Morbi vestibulum, velit id pretium iaculis, diam erat fermentum justo, nec condimentum neque sapien placerat ante.",1,Mechanical Systems Engineer
697,rtrinemanjc@jigsy.com,c7c5412a99926be2a9b4d8b2906a9f0e,ec5b298177b660f06082f6e51bcf449d5c2ff906f022b816beb5c21ffdc9c28e,Rainer,Trineman,rtrinemanjc,1967-11-06,https://i.imgur.com/0avxl7q.jpg,"Duis bibendum, felis sed interdum venenatis, turpis enim blandit mi, in porttitor pede justo eu massa. Donec dapibus. Duis at velit eu est congue elementum. In hac habitasse platea dictumst. Morbi vestibulum, velit id pretium iaculis, diam erat fermentum justo, nec condimentum neque sapien placerat ante. Nulla justo. Aliquam quis turpis eget elit sodales scelerisque.",1,Administrative Assistant IV
699,dzimmermeisterje@msn.com,c7c5412a99926be2a9b4d8b2906a9f0e,ec5b298177b660f06082f6e51bcf449d5c2ff906f022b816beb5c21ffdc9c28e,Decca,Zimmermeister,dzimmermeisterje,1997-04-04,https://i.imgur.com/0avxl7q.jpg,"Nunc rhoncus dui vel sem. Sed sagittis. Nam congue, risus semper porta volutpat, quam pede lobortis ligula, sit amet eleifend pede libero quis orci. Nullam molestie nibh in lectus.",1,Quality Control Specialist
700,mdownjf@php.net,c7c5412a99926be2a9b4d8b2906a9f0e,ec5b298177b660f06082f6e51bcf449d5c2ff906f022b816beb5c21ffdc9c28e,Malchy,Down,mdownjf,1973-11-22,https://i.imgur.com/0avxl7q.jpg,"Morbi quis tortor id nulla ultrices aliquet. Maecenas leo odio, condimentum id, luctus nec, molestie sed, justo. Pellentesque viverra pede ac diam. Cras pellentesque volutpat dui. Maecenas tristique, est et tempus semper, est quam pharetra magna, ac consequat metus sapien ut nunc. Vestibulum ante ipsum primis in faucibus orci luctus et ultrices posuere cubilia Curae; Mauris viverra diam vitae quam. Suspendisse potenti. Nullam porttitor lacus at turpis.",1,Quality Control Specialist
701,jrushbrookejg@dedecms.com,c7c5412a99926be2a9b4d8b2906a9f0e,ec5b298177b660f06082f6e51bcf449d5c2ff906f022b816beb5c21ffdc9c28e,Jared,Rushbrooke,jrushbrookejg,1953-08-04,https://i.imgur.com/0avxl7q.jpg,"Fusce congue, diam id ornare imperdiet, sapien urna pretium nisl, ut volutpat sapien arcu sed augue. Aliquam erat volutpat. In congue. Etiam justo. Etiam pretium iaculis justo. In hac habitasse platea dictumst. Etiam faucibus cursus urna. Ut tellus.",1,Marketing Manager
703,ereichardtji@goodreads.com,c7c5412a99926be2a9b4d8b2906a9f0e,ec5b298177b660f06082f6e51bcf449d5c2ff906f022b816beb5c21ffdc9c28e,Emerson,Reichardt,ereichardtji,1962-11-27,https://i.imgur.com/0avxl7q.jpg,"Proin at turpis a pede posuere nonummy. Integer non velit. Donec diam neque, vestibulum eget, vulputate ut, ultrices vel, augue. Vestibulum ante ipsum primis in faucibus orci luctus et ultrices posuere cubilia Curae; Donec pharetra, magna vestibulum aliquet ultrices, erat tortor sollicitudin mi, sit amet lobortis sapien sapien non mi.",1,Technical Writer
705,esciacovellijk@time.com,c7c5412a99926be2a9b4d8b2906a9f0e,ec5b298177b660f06082f6e51bcf449d5c2ff906f022b816beb5c21ffdc9c28e,Emmit,Sciacovelli,esciacovellijk,1977-06-07,https://i.imgur.com/0avxl7q.jpg,"Nulla neque libero, convallis eget, eleifend luctus, ultricies eu, nibh. Quisque id justo sit amet sapien dignissim vestibulum. Vestibulum ante ipsum primis in faucibus orci luctus et ultrices posuere cubilia Curae; Nulla dapibus dolor vel est. Donec odio justo, sollicitudin ut, suscipit a, feugiat et, eros. Vestibulum ac est lacinia nisi venenatis tristique. Fusce congue, diam id ornare imperdiet, sapien urna pretium nisl, ut volutpat sapien arcu sed augue.",1,Product Engineer
706,dtaigjl@fema.gov,c7c5412a99926be2a9b4d8b2906a9f0e,ec5b298177b660f06082f6e51bcf449d5c2ff906f022b816beb5c21ffdc9c28e,Dillie,Taig,dtaigjl,1972-08-28,https://i.imgur.com/0avxl7q.jpg,"Pellentesque at nulla. Suspendisse potenti. Cras in purus eu magna vulputate luctus. Cum sociis natoque penatibus et magnis dis parturient montes, nascetur ridiculus mus. Vivamus vestibulum sagittis sapien.",1,Nurse
707,vwalentajm@wufoo.com,c7c5412a99926be2a9b4d8b2906a9f0e,ec5b298177b660f06082f6e51bcf449d5c2ff906f022b816beb5c21ffdc9c28e,Vachel,Walenta,vwalentajm,1987-11-11,https://i.imgur.com/0avxl7q.jpg,"Morbi vel lectus in quam fringilla rhoncus. Mauris enim leo, rhoncus sed, vestibulum sit amet, cursus id, turpis. Integer aliquet, massa id lobortis convallis, tortor risus dapibus augue, vel accumsan tellus nisi eu orci. Mauris lacinia sapien quis libero. Nullam sit amet turpis elementum ligula vehicula consequat.",1,Physical Therapy Assistant
708,tmacgalljn@vinaora.com,c7c5412a99926be2a9b4d8b2906a9f0e,ec5b298177b660f06082f6e51bcf449d5c2ff906f022b816beb5c21ffdc9c28e,Tyson,MacGall,tmacgalljn,2000-05-27,https://i.imgur.com/0avxl7q.jpg,"Vestibulum ante ipsum primis in faucibus orci luctus et ultrices posuere cubilia Curae; Donec pharetra, magna vestibulum aliquet ultrices, erat tortor sollicitudin mi, sit amet lobortis sapien sapien non mi. Integer ac neque. Duis bibendum. Morbi non quam nec dui luctus rutrum. Nulla tellus. In sagittis dui vel nisl.",1,Mechanical Systems Engineer
712,brudyardjr@nba.com,c7c5412a99926be2a9b4d8b2906a9f0e,ec5b298177b660f06082f6e51bcf449d5c2ff906f022b816beb5c21ffdc9c28e,Baryram,Rudyard,brudyardjr,1997-06-03,https://i.imgur.com/0avxl7q.jpg,"Donec vitae nisi. Nam ultrices, libero non mattis pulvinar, nulla pede ullamcorper augue, a suscipit nulla elit ac nulla. Sed vel enim sit amet nunc viverra dapibus. Nulla suscipit ligula in lacus. Curabitur at ipsum ac tellus semper interdum. Mauris ullamcorper purus sit amet nulla.",1,Quality Control Specialist
713,fserraillierjs@uiuc.edu,c7c5412a99926be2a9b4d8b2906a9f0e,ec5b298177b660f06082f6e51bcf449d5c2ff906f022b816beb5c21ffdc9c28e,Fleming,Serraillier,fserraillierjs,1953-11-21,https://i.imgur.com/0avxl7q.jpg,"Nam nulla. Integer pede justo, lacinia eget, tincidunt eget, tempus vel, pede. Morbi porttitor lorem id ligula. Suspendisse ornare consequat lectus.",1,Director of Sales
846,mpunyernh@sfgate.com,c7c5412a99926be2a9b4d8b2906a9f0e,ec5b298177b660f06082f6e51bcf449d5c2ff906f022b816beb5c21ffdc9c28e,Muhammad,Punyer,mpunyernh,1991-03-09,https://i.imgur.com/0avxl7q.jpg,Praesent blandit lacinia erat. Vestibulum sed magna at nunc commodo placerat. Praesent blandit.,1,VP Sales
714,cmeininkingjt@i2i.jp,c7c5412a99926be2a9b4d8b2906a9f0e,ec5b298177b660f06082f6e51bcf449d5c2ff906f022b816beb5c21ffdc9c28e,Chester,Meininking,cmeininkingjt,1974-10-24,https://i.imgur.com/0avxl7q.jpg,"Pellentesque viverra pede ac diam. Cras pellentesque volutpat dui. Maecenas tristique, est et tempus semper, est quam pharetra magna, ac consequat metus sapien ut nunc. Vestibulum ante ipsum primis in faucibus orci luctus et ultrices posuere cubilia Curae; Mauris viverra diam vitae quam. Suspendisse potenti.",1,Senior Financial Analyst
716,dkiggeljv@macromedia.com,c7c5412a99926be2a9b4d8b2906a9f0e,ec5b298177b660f06082f6e51bcf449d5c2ff906f022b816beb5c21ffdc9c28e,Dal,Kiggel,dkiggeljv,1981-12-19,https://i.imgur.com/0avxl7q.jpg,"Cum sociis natoque penatibus et magnis dis parturient montes, nascetur ridiculus mus. Etiam vel augue. Vestibulum rutrum rutrum neque. Aenean auctor gravida sem. Praesent id massa id nisl venenatis lacinia. Aenean sit amet justo. Morbi ut odio. Cras mi pede, malesuada in, imperdiet et, commodo vulputate, justo.",1,Research Nurse
717,hfullbrookjw@discovery.com,c7c5412a99926be2a9b4d8b2906a9f0e,ec5b298177b660f06082f6e51bcf449d5c2ff906f022b816beb5c21ffdc9c28e,Hyatt,Fullbrook,hfullbrookjw,1993-04-23,https://i.imgur.com/0avxl7q.jpg,"Nam ultrices, libero non mattis pulvinar, nulla pede ullamcorper augue, a suscipit nulla elit ac nulla. Sed vel enim sit amet nunc viverra dapibus. Nulla suscipit ligula in lacus.",1,Staff Accountant IV
720,ebeninijz@cnbc.com,c7c5412a99926be2a9b4d8b2906a9f0e,ec5b298177b660f06082f6e51bcf449d5c2ff906f022b816beb5c21ffdc9c28e,Eldon,Benini,ebeninijz,1976-02-19,https://i.imgur.com/0avxl7q.jpg,"Lorem ipsum dolor sit amet, consectetuer adipiscing elit. Proin interdum mauris non ligula pellentesque ultrices. Phasellus id sapien in sapien iaculis congue. Vivamus metus arcu, adipiscing molestie, hendrerit at, vulputate vitae, nisl. Aenean lectus. Pellentesque eget nunc. Donec quis orci eget orci vehicula condimentum.",1,Systems Administrator I
723,mbutchartk2@qq.com,c7c5412a99926be2a9b4d8b2906a9f0e,ec5b298177b660f06082f6e51bcf449d5c2ff906f022b816beb5c21ffdc9c28e,Milty,Butchart,mbutchartk2,1987-01-14,https://i.imgur.com/0avxl7q.jpg,"Duis ac nibh. Fusce lacus purus, aliquet at, feugiat non, pretium quis, lectus. Suspendisse potenti. In eleifend quam a odio. In hac habitasse platea dictumst.",1,VP Sales
724,lwestwoodk3@bravesites.com,c7c5412a99926be2a9b4d8b2906a9f0e,ec5b298177b660f06082f6e51bcf449d5c2ff906f022b816beb5c21ffdc9c28e,Lukas,Westwood,lwestwoodk3,1968-10-31,https://i.imgur.com/0avxl7q.jpg,"Quisque id justo sit amet sapien dignissim vestibulum. Vestibulum ante ipsum primis in faucibus orci luctus et ultrices posuere cubilia Curae; Nulla dapibus dolor vel est. Donec odio justo, sollicitudin ut, suscipit a, feugiat et, eros.",1,Director of Sales
725,bcastanak4@senate.gov,c7c5412a99926be2a9b4d8b2906a9f0e,ec5b298177b660f06082f6e51bcf449d5c2ff906f022b816beb5c21ffdc9c28e,Byrom,Castana,bcastanak4,1956-07-20,https://i.imgur.com/0avxl7q.jpg,"Integer non velit. Donec diam neque, vestibulum eget, vulputate ut, ultrices vel, augue. Vestibulum ante ipsum primis in faucibus orci luctus et ultrices posuere cubilia Curae; Donec pharetra, magna vestibulum aliquet ultrices, erat tortor sollicitudin mi, sit amet lobortis sapien sapien non mi. Integer ac neque.",1,Compensation Analyst
804,cstrongitharmmb@e-recht24.de,c7c5412a99926be2a9b4d8b2906a9f0e,ec5b298177b660f06082f6e51bcf449d5c2ff906f022b816beb5c21ffdc9c28e,Christophe,Strongitharm,cstrongitharmmb,1989-03-10,https://i.imgur.com/0avxl7q.jpg,Sed accumsan felis. Ut at dolor quis odio consequat varius. Integer ac leo. Pellentesque ultrices mattis odio. Donec vitae nisi.,1,Budget/Accounting Analyst I
728,mtirrellk7@comsenz.com,c7c5412a99926be2a9b4d8b2906a9f0e,ec5b298177b660f06082f6e51bcf449d5c2ff906f022b816beb5c21ffdc9c28e,Meade,Tirrell,mtirrellk7,1982-09-10,https://i.imgur.com/0avxl7q.jpg,"Duis bibendum, felis sed interdum venenatis, turpis enim blandit mi, in porttitor pede justo eu massa. Donec dapibus. Duis at velit eu est congue elementum. In hac habitasse platea dictumst. Morbi vestibulum, velit id pretium iaculis, diam erat fermentum justo, nec condimentum neque sapien placerat ante. Nulla justo. Aliquam quis turpis eget elit sodales scelerisque.",1,Software Consultant
729,cdoornbosk8@mac.com,c7c5412a99926be2a9b4d8b2906a9f0e,ec5b298177b660f06082f6e51bcf449d5c2ff906f022b816beb5c21ffdc9c28e,Colman,Doornbos,cdoornbosk8,1973-02-01,https://i.imgur.com/0avxl7q.jpg,"Vivamus in felis eu sapien cursus vestibulum. Proin eu mi. Nulla ac enim. In tempor, turpis nec euismod scelerisque, quam turpis adipiscing lorem, vitae mattis nibh ligula nec sem. Duis aliquam convallis nunc.",1,Structural Analysis Engineer
730,aclausenk9@who.int,c7c5412a99926be2a9b4d8b2906a9f0e,ec5b298177b660f06082f6e51bcf449d5c2ff906f022b816beb5c21ffdc9c28e,Ansell,Clausen,aclausenk9,1976-12-14,https://i.imgur.com/0avxl7q.jpg,"Proin eu mi. Nulla ac enim. In tempor, turpis nec euismod scelerisque, quam turpis adipiscing lorem, vitae mattis nibh ligula nec sem. Duis aliquam convallis nunc. Proin at turpis a pede posuere nonummy. Integer non velit. Donec diam neque, vestibulum eget, vulputate ut, ultrices vel, augue. Vestibulum ante ipsum primis in faucibus orci luctus et ultrices posuere cubilia Curae; Donec pharetra, magna vestibulum aliquet ultrices, erat tortor sollicitudin mi, sit amet lobortis sapien sapien non mi.",1,Analyst Programmer
731,gfreeborneka@networksolutions.com,c7c5412a99926be2a9b4d8b2906a9f0e,ec5b298177b660f06082f6e51bcf449d5c2ff906f022b816beb5c21ffdc9c28e,Gale,Freeborne,gfreeborneka,1984-11-12,https://i.imgur.com/0avxl7q.jpg,"Curabitur in libero ut massa volutpat convallis. Morbi odio odio, elementum eu, interdum eu, tincidunt in, leo. Maecenas pulvinar lobortis est. Phasellus sit amet erat. Nulla tempus.",1,VP Marketing
733,mthorburnkc@tinypic.com,c7c5412a99926be2a9b4d8b2906a9f0e,ec5b298177b660f06082f6e51bcf449d5c2ff906f022b816beb5c21ffdc9c28e,Miltie,Thorburn,mthorburnkc,1975-10-23,https://i.imgur.com/0avxl7q.jpg,"Nulla nisl. Nunc nisl. Duis bibendum, felis sed interdum venenatis, turpis enim blandit mi, in porttitor pede justo eu massa. Donec dapibus. Duis at velit eu est congue elementum.",1,Biostatistician II
737,gforresterkg@pcworld.com,c7c5412a99926be2a9b4d8b2906a9f0e,ec5b298177b660f06082f6e51bcf449d5c2ff906f022b816beb5c21ffdc9c28e,Gibby,Forrester,gforresterkg,1958-10-10,https://i.imgur.com/0avxl7q.jpg,"Curabitur convallis. Duis consequat dui nec nisi volutpat eleifend. Donec ut dolor. Morbi vel lectus in quam fringilla rhoncus. Mauris enim leo, rhoncus sed, vestibulum sit amet, cursus id, turpis. Integer aliquet, massa id lobortis convallis, tortor risus dapibus augue, vel accumsan tellus nisi eu orci. Mauris lacinia sapien quis libero.",1,Marketing Manager
738,nkalbkh@odnoklassniki.ru,c7c5412a99926be2a9b4d8b2906a9f0e,ec5b298177b660f06082f6e51bcf449d5c2ff906f022b816beb5c21ffdc9c28e,Nicolis,Kalb,nkalbkh,1994-02-27,https://i.imgur.com/0avxl7q.jpg,"Curabitur in libero ut massa volutpat convallis. Morbi odio odio, elementum eu, interdum eu, tincidunt in, leo. Maecenas pulvinar lobortis est. Phasellus sit amet erat. Nulla tempus. Vivamus in felis eu sapien cursus vestibulum.",1,Media Manager I
741,flebromkk@creativecommons.org,c7c5412a99926be2a9b4d8b2906a9f0e,ec5b298177b660f06082f6e51bcf449d5c2ff906f022b816beb5c21ffdc9c28e,Ferris,Le Brom,flebromkk,1982-01-10,https://i.imgur.com/0avxl7q.jpg,"Quisque id justo sit amet sapien dignissim vestibulum. Vestibulum ante ipsum primis in faucibus orci luctus et ultrices posuere cubilia Curae; Nulla dapibus dolor vel est. Donec odio justo, sollicitudin ut, suscipit a, feugiat et, eros. Vestibulum ac est lacinia nisi venenatis tristique. Fusce congue, diam id ornare imperdiet, sapien urna pretium nisl, ut volutpat sapien arcu sed augue.",1,Office Assistant II
743,fhannenkm@hhs.gov,c7c5412a99926be2a9b4d8b2906a9f0e,ec5b298177b660f06082f6e51bcf449d5c2ff906f022b816beb5c21ffdc9c28e,Filmore,Hannen,fhannenkm,1968-08-28,https://i.imgur.com/0avxl7q.jpg,"Aenean sit amet justo. Morbi ut odio. Cras mi pede, malesuada in, imperdiet et, commodo vulputate, justo. In blandit ultrices enim. Lorem ipsum dolor sit amet, consectetuer adipiscing elit.",1,Budget/Accounting Analyst IV
747,cverissimokq@tiny.cc,c7c5412a99926be2a9b4d8b2906a9f0e,ec5b298177b660f06082f6e51bcf449d5c2ff906f022b816beb5c21ffdc9c28e,Cory,Verissimo,cverissimokq,1979-03-08,https://i.imgur.com/0avxl7q.jpg,In hac habitasse platea dictumst. Maecenas ut massa quis augue luctus tincidunt. Nulla mollis molestie lorem. Quisque ut erat. Curabitur gravida nisi at nibh. In hac habitasse platea dictumst.,1,Recruiter
749,strammelks@mtv.com,c7c5412a99926be2a9b4d8b2906a9f0e,ec5b298177b660f06082f6e51bcf449d5c2ff906f022b816beb5c21ffdc9c28e,Sammy,Trammel,strammelks,1958-08-31,https://i.imgur.com/0avxl7q.jpg,"Morbi odio odio, elementum eu, interdum eu, tincidunt in, leo. Maecenas pulvinar lobortis est. Phasellus sit amet erat. Nulla tempus. Vivamus in felis eu sapien cursus vestibulum. Proin eu mi. Nulla ac enim.",1,Tax Accountant
750,bmoinekt@ebay.co.uk,c7c5412a99926be2a9b4d8b2906a9f0e,ec5b298177b660f06082f6e51bcf449d5c2ff906f022b816beb5c21ffdc9c28e,Berton,Moine,bmoinekt,1991-08-26,https://i.imgur.com/0avxl7q.jpg,"Mauris enim leo, rhoncus sed, vestibulum sit amet, cursus id, turpis. Integer aliquet, massa id lobortis convallis, tortor risus dapibus augue, vel accumsan tellus nisi eu orci. Mauris lacinia sapien quis libero. Nullam sit amet turpis elementum ligula vehicula consequat.",1,Assistant Media Planner
751,swestcottku@yellowpages.com,c7c5412a99926be2a9b4d8b2906a9f0e,ec5b298177b660f06082f6e51bcf449d5c2ff906f022b816beb5c21ffdc9c28e,Skipton,Westcott,swestcottku,1966-04-23,https://i.imgur.com/0avxl7q.jpg,"Donec quis orci eget orci vehicula condimentum. Curabitur in libero ut massa volutpat convallis. Morbi odio odio, elementum eu, interdum eu, tincidunt in, leo. Maecenas pulvinar lobortis est. Phasellus sit amet erat. Nulla tempus.",1,Assistant Professor
752,mswannellkv@hexun.com,c7c5412a99926be2a9b4d8b2906a9f0e,ec5b298177b660f06082f6e51bcf449d5c2ff906f022b816beb5c21ffdc9c28e,Murray,Swannell,mswannellkv,1951-11-15,https://i.imgur.com/0avxl7q.jpg,"Sed vel enim sit amet nunc viverra dapibus. Nulla suscipit ligula in lacus. Curabitur at ipsum ac tellus semper interdum. Mauris ullamcorper purus sit amet nulla. Quisque arcu libero, rutrum ac, lobortis vel, dapibus at, diam.",1,Civil Engineer
753,dbenoikw@oakley.com,c7c5412a99926be2a9b4d8b2906a9f0e,ec5b298177b660f06082f6e51bcf449d5c2ff906f022b816beb5c21ffdc9c28e,Dell,Benoi,dbenoikw,1954-09-18,https://i.imgur.com/0avxl7q.jpg,"In sagittis dui vel nisl. Duis ac nibh. Fusce lacus purus, aliquet at, feugiat non, pretium quis, lectus. Suspendisse potenti.",1,Research Assistant IV
754,dosheakx@elegantthemes.com,c7c5412a99926be2a9b4d8b2906a9f0e,ec5b298177b660f06082f6e51bcf449d5c2ff906f022b816beb5c21ffdc9c28e,Dwight,O'Shea,dosheakx,1985-10-04,https://i.imgur.com/0avxl7q.jpg,"Integer a nibh. In quis justo. Maecenas rhoncus aliquam lacus. Morbi quis tortor id nulla ultrices aliquet. Maecenas leo odio, condimentum id, luctus nec, molestie sed, justo.",1,Software Test Engineer II
755,tmerrickky@gmpg.org,c7c5412a99926be2a9b4d8b2906a9f0e,ec5b298177b660f06082f6e51bcf449d5c2ff906f022b816beb5c21ffdc9c28e,Tab,Merrick,tmerrickky,1993-07-25,https://i.imgur.com/0avxl7q.jpg,"Nulla ut erat id mauris vulputate elementum. Nullam varius. Nulla facilisi. Cras non velit nec nisi vulputate nonummy. Maecenas tincidunt lacus at velit. Vivamus vel nulla eget eros elementum pellentesque. Quisque porta volutpat erat. Quisque erat eros, viverra eget, congue eget, semper rutrum, nulla.",1,Senior Quality Engineer
756,tleijskz@boston.com,c7c5412a99926be2a9b4d8b2906a9f0e,ec5b298177b660f06082f6e51bcf449d5c2ff906f022b816beb5c21ffdc9c28e,Thorndike,Leijs,tleijskz,1981-01-23,https://i.imgur.com/0avxl7q.jpg,Nullam varius. Nulla facilisi. Cras non velit nec nisi vulputate nonummy.,1,Web Designer II
757,equereel0@github.io,c7c5412a99926be2a9b4d8b2906a9f0e,ec5b298177b660f06082f6e51bcf449d5c2ff906f022b816beb5c21ffdc9c28e,Eldon,Queree,equereel0,1982-08-21,https://i.imgur.com/0avxl7q.jpg,"Quisque erat eros, viverra eget, congue eget, semper rutrum, nulla. Nunc purus. Phasellus in felis. Donec semper sapien a libero. Nam dui. Proin leo odio, porttitor id, consequat in, consequat ut, nulla.",1,Senior Financial Analyst
758,fwhittenburyl1@xing.com,c7c5412a99926be2a9b4d8b2906a9f0e,ec5b298177b660f06082f6e51bcf449d5c2ff906f022b816beb5c21ffdc9c28e,Fowler,Whittenbury,fwhittenburyl1,1967-07-19,https://i.imgur.com/0avxl7q.jpg,"Fusce consequat. Nulla nisl. Nunc nisl. Duis bibendum, felis sed interdum venenatis, turpis enim blandit mi, in porttitor pede justo eu massa.",1,Budget/Accounting Analyst III
759,hmeynelll2@deliciousdays.com,c7c5412a99926be2a9b4d8b2906a9f0e,ec5b298177b660f06082f6e51bcf449d5c2ff906f022b816beb5c21ffdc9c28e,Hayden,Meynell,hmeynelll2,1954-04-27,https://i.imgur.com/0avxl7q.jpg,"Vestibulum ante ipsum primis in faucibus orci luctus et ultrices posuere cubilia Curae; Donec pharetra, magna vestibulum aliquet ultrices, erat tortor sollicitudin mi, sit amet lobortis sapien sapien non mi. Integer ac neque. Duis bibendum. Morbi non quam nec dui luctus rutrum.",1,Financial Analyst
761,mralphsl4@state.gov,c7c5412a99926be2a9b4d8b2906a9f0e,ec5b298177b660f06082f6e51bcf449d5c2ff906f022b816beb5c21ffdc9c28e,Marcel,Ralphs,mralphsl4,1959-09-08,https://i.imgur.com/0avxl7q.jpg,"Integer ac neque. Duis bibendum. Morbi non quam nec dui luctus rutrum. Nulla tellus. In sagittis dui vel nisl. Duis ac nibh. Fusce lacus purus, aliquet at, feugiat non, pretium quis, lectus.",1,Accounting Assistant III
763,scurgenvenl6@last.fm,c7c5412a99926be2a9b4d8b2906a9f0e,ec5b298177b660f06082f6e51bcf449d5c2ff906f022b816beb5c21ffdc9c28e,Shellysheldon,Curgenven,scurgenvenl6,1972-01-21,https://i.imgur.com/0avxl7q.jpg,"Morbi non lectus. Aliquam sit amet diam in magna bibendum imperdiet. Nullam orci pede, venenatis non, sodales sed, tincidunt eu, felis. Fusce posuere felis sed lacus.",1,Statistician IV
769,cbettslc@java.com,c7c5412a99926be2a9b4d8b2906a9f0e,ec5b298177b660f06082f6e51bcf449d5c2ff906f022b816beb5c21ffdc9c28e,Chic,Betts,cbettslc,1955-07-22,https://i.imgur.com/0avxl7q.jpg,"Phasellus id sapien in sapien iaculis congue. Vivamus metus arcu, adipiscing molestie, hendrerit at, vulputate vitae, nisl. Aenean lectus. Pellentesque eget nunc. Donec quis orci eget orci vehicula condimentum. Curabitur in libero ut massa volutpat convallis. Morbi odio odio, elementum eu, interdum eu, tincidunt in, leo. Maecenas pulvinar lobortis est.",1,Sales Associate
775,kposselwhiteli@indiatimes.com,c7c5412a99926be2a9b4d8b2906a9f0e,ec5b298177b660f06082f6e51bcf449d5c2ff906f022b816beb5c21ffdc9c28e,Koenraad,Posselwhite,kposselwhiteli,1990-11-25,https://i.imgur.com/0avxl7q.jpg,"Praesent id massa id nisl venenatis lacinia. Aenean sit amet justo. Morbi ut odio. Cras mi pede, malesuada in, imperdiet et, commodo vulputate, justo. In blandit ultrices enim. Lorem ipsum dolor sit amet, consectetuer adipiscing elit. Proin interdum mauris non ligula pellentesque ultrices.",1,Environmental Specialist
778,mquartonll@dyndns.org,c7c5412a99926be2a9b4d8b2906a9f0e,ec5b298177b660f06082f6e51bcf449d5c2ff906f022b816beb5c21ffdc9c28e,Matthiew,Quarton,mquartonll,2000-02-22,https://i.imgur.com/0avxl7q.jpg,"Cum sociis natoque penatibus et magnis dis parturient montes, nascetur ridiculus mus. Etiam vel augue. Vestibulum rutrum rutrum neque. Aenean auctor gravida sem. Praesent id massa id nisl venenatis lacinia. Aenean sit amet justo. Morbi ut odio.",1,Health Coach IV
780,hluchettiln@earthlink.net,c7c5412a99926be2a9b4d8b2906a9f0e,ec5b298177b660f06082f6e51bcf449d5c2ff906f022b816beb5c21ffdc9c28e,Hillier,Luchetti,hluchettiln,1983-08-09,https://i.imgur.com/0avxl7q.jpg,Nulla justo. Aliquam quis turpis eget elit sodales scelerisque. Mauris sit amet eros.,1,Geological Engineer
781,okilmurraylo@123-reg.co.uk,c7c5412a99926be2a9b4d8b2906a9f0e,ec5b298177b660f06082f6e51bcf449d5c2ff906f022b816beb5c21ffdc9c28e,Orion,Kilmurray,okilmurraylo,1990-03-25,https://i.imgur.com/0avxl7q.jpg,Quisque ut erat. Curabitur gravida nisi at nibh. In hac habitasse platea dictumst.,1,Structural Engineer
785,lsoanels@fastcompany.com,c7c5412a99926be2a9b4d8b2906a9f0e,ec5b298177b660f06082f6e51bcf449d5c2ff906f022b816beb5c21ffdc9c28e,Leroi,Soane,lsoanels,1955-07-23,https://i.imgur.com/0avxl7q.jpg,"Vestibulum ante ipsum primis in faucibus orci luctus et ultrices posuere cubilia Curae; Donec pharetra, magna vestibulum aliquet ultrices, erat tortor sollicitudin mi, sit amet lobortis sapien sapien non mi. Integer ac neque. Duis bibendum.",1,Automation Specialist IV
788,llantifflv@free.fr,c7c5412a99926be2a9b4d8b2906a9f0e,ec5b298177b660f06082f6e51bcf449d5c2ff906f022b816beb5c21ffdc9c28e,Lionel,Lantiff,llantifflv,1989-11-07,https://i.imgur.com/0avxl7q.jpg,"Aliquam augue quam, sollicitudin vitae, consectetuer eget, rutrum at, lorem. Integer tincidunt ante vel ipsum. Praesent blandit lacinia erat. Vestibulum sed magna at nunc commodo placerat.",1,Engineer II
793,moneilm0@homestead.com,c7c5412a99926be2a9b4d8b2906a9f0e,ec5b298177b660f06082f6e51bcf449d5c2ff906f022b816beb5c21ffdc9c28e,Miller,O'Neil,moneilm0,1951-10-24,https://i.imgur.com/0avxl7q.jpg,"Curabitur convallis. Duis consequat dui nec nisi volutpat eleifend. Donec ut dolor. Morbi vel lectus in quam fringilla rhoncus. Mauris enim leo, rhoncus sed, vestibulum sit amet, cursus id, turpis.",1,Web Developer III
795,ljaycockm2@nps.gov,c7c5412a99926be2a9b4d8b2906a9f0e,ec5b298177b660f06082f6e51bcf449d5c2ff906f022b816beb5c21ffdc9c28e,Lewes,Jaycock,ljaycockm2,1975-12-21,https://i.imgur.com/0avxl7q.jpg,"Donec ut dolor. Morbi vel lectus in quam fringilla rhoncus. Mauris enim leo, rhoncus sed, vestibulum sit amet, cursus id, turpis.",1,Financial Analyst
801,eeschalettem8@china.com.cn,c7c5412a99926be2a9b4d8b2906a9f0e,ec5b298177b660f06082f6e51bcf449d5c2ff906f022b816beb5c21ffdc9c28e,Elwyn,Eschalette,eeschalettem8,1986-07-03,https://i.imgur.com/0avxl7q.jpg,"Proin at turpis a pede posuere nonummy. Integer non velit. Donec diam neque, vestibulum eget, vulputate ut, ultrices vel, augue.",1,Systems Administrator III
