id,email,password_salt,password_hashed,first_name,last_name,nickname,birthday,avatar,intro,gender,occupation
791,mpimblottly@nyu.edu,c7c5412a99926be2a9b4d8b2906a9f0e,ec5b298177b660f06082f6e51bcf449d5c2ff906f022b816beb5c21ffdc9c28e,Mara,Pimblott,mpimblottly,1993-07-16,https://i.imgur.com/0avxl7q.jpg,Vivamus in felis eu sapien cursus vestibulum. Proin eu mi. Nulla ac enim.,2,Operator
585,dweatherillg8@feedburner.com,c7c5412a99926be2a9b4d8b2906a9f0e,ec5b298177b660f06082f6e51bcf449d5c2ff906f022b816beb5c21ffdc9c28e,Dominick,Weatherill,dweatherillg8,1967-05-29,https://i.imgur.com/0avxl7q.jpg,Phasellus sit amet erat. Nulla tempus. Vivamus in felis eu sapien cursus vestibulum.,1,Research Associate
609,wpainswickgw@t.co,c7c5412a99926be2a9b4d8b2906a9f0e,ec5b298177b660f06082f6e51bcf449d5c2ff906f022b816beb5c21ffdc9c28e,Wandis,Painswick,wpainswickgw,1962-06-24,https://i.imgur.com/0avxl7q.jpg,"Duis ac nibh. Fusce lacus purus, aliquet at, feugiat non, pretium quis, lectus. Suspendisse potenti. In eleifend quam a odio. In hac habitasse platea dictumst. Maecenas ut massa quis augue luctus tincidunt.",2,Librarian
576,dcluniefz@ning.com,c7c5412a99926be2a9b4d8b2906a9f0e,ec5b298177b660f06082f6e51bcf449d5c2ff906f022b816beb5c21ffdc9c28e,Dania,Clunie,dcluniefz,1995-10-08,https://i.imgur.com/0avxl7q.jpg,"Suspendisse potenti. Cras in purus eu magna vulputate luctus. Cum sociis natoque penatibus et magnis dis parturient montes, nascetur ridiculus mus. Vivamus vestibulum sagittis sapien. Cum sociis natoque penatibus et magnis dis parturient montes, nascetur ridiculus mus. Etiam vel augue.",2,Senior Editor
577,sorkneyg0@live.com,c7c5412a99926be2a9b4d8b2906a9f0e,ec5b298177b660f06082f6e51bcf449d5c2ff906f022b816beb5c21ffdc9c28e,Sophronia,Orkney,sorkneyg0,1967-10-17,https://i.imgur.com/0avxl7q.jpg,"Donec quis orci eget orci vehicula condimentum. Curabitur in libero ut massa volutpat convallis. Morbi odio odio, elementum eu, interdum eu, tincidunt in, leo. Maecenas pulvinar lobortis est. Phasellus sit amet erat. Nulla tempus.",2,Marketing Assistant
579,rthundermang2@sourceforge.net,c7c5412a99926be2a9b4d8b2906a9f0e,ec5b298177b660f06082f6e51bcf449d5c2ff906f022b816beb5c21ffdc9c28e,Randy,Thunderman,rthundermang2,1994-12-24,https://i.imgur.com/0avxl7q.jpg,"Proin at turpis a pede posuere nonummy. Integer non velit. Donec diam neque, vestibulum eget, vulputate ut, ultrices vel, augue.",2,Health Coach III
580,astockneyg3@google.com.hk,c7c5412a99926be2a9b4d8b2906a9f0e,ec5b298177b660f06082f6e51bcf449d5c2ff906f022b816beb5c21ffdc9c28e,Alyssa,Stockney,astockneyg3,1967-03-04,https://i.imgur.com/0avxl7q.jpg,Mauris lacinia sapien quis libero. Nullam sit amet turpis elementum ligula vehicula consequat. Morbi a ipsum. Integer a nibh.,2,Marketing Assistant
581,cattwaterg4@discovery.com,c7c5412a99926be2a9b4d8b2906a9f0e,ec5b298177b660f06082f6e51bcf449d5c2ff906f022b816beb5c21ffdc9c28e,Cathleen,Attwater,cattwaterg4,1951-06-12,https://i.imgur.com/0avxl7q.jpg,"In hac habitasse platea dictumst. Maecenas ut massa quis augue luctus tincidunt. Nulla mollis molestie lorem. Quisque ut erat. Curabitur gravida nisi at nibh. In hac habitasse platea dictumst. Aliquam augue quam, sollicitudin vitae, consectetuer eget, rutrum at, lorem. Integer tincidunt ante vel ipsum.",2,GIS Technical Architect
582,lbodkerg5@unblog.fr,c7c5412a99926be2a9b4d8b2906a9f0e,ec5b298177b660f06082f6e51bcf449d5c2ff906f022b816beb5c21ffdc9c28e,Laurette,Bodker,lbodkerg5,1985-09-24,https://i.imgur.com/0avxl7q.jpg,Aliquam quis turpis eget elit sodales scelerisque. Mauris sit amet eros. Suspendisse accumsan tortor quis turpis. Sed ante. Vivamus tortor. Duis mattis egestas metus. Aenean fermentum.,2,Research Nurse
584,tstoneg7@desdev.cn,c7c5412a99926be2a9b4d8b2906a9f0e,ec5b298177b660f06082f6e51bcf449d5c2ff906f022b816beb5c21ffdc9c28e,Tamra,Stone,tstoneg7,1981-12-20,https://i.imgur.com/0avxl7q.jpg,"Curabitur gravida nisi at nibh. In hac habitasse platea dictumst. Aliquam augue quam, sollicitudin vitae, consectetuer eget, rutrum at, lorem. Integer tincidunt ante vel ipsum.",2,Teacher
586,rpipetg9@cpanel.net,c7c5412a99926be2a9b4d8b2906a9f0e,ec5b298177b660f06082f6e51bcf449d5c2ff906f022b816beb5c21ffdc9c28e,Ramonda,Pipet,rpipetg9,1962-01-05,https://i.imgur.com/0avxl7q.jpg,"Vestibulum ante ipsum primis in faucibus orci luctus et ultrices posuere cubilia Curae; Nulla dapibus dolor vel est. Donec odio justo, sollicitudin ut, suscipit a, feugiat et, eros. Vestibulum ac est lacinia nisi venenatis tristique. Fusce congue, diam id ornare imperdiet, sapien urna pretium nisl, ut volutpat sapien arcu sed augue.",2,Financial Advisor
588,lforgiegb@google.ca,c7c5412a99926be2a9b4d8b2906a9f0e,ec5b298177b660f06082f6e51bcf449d5c2ff906f022b816beb5c21ffdc9c28e,Liesa,Forgie,lforgiegb,1977-05-20,https://i.imgur.com/0avxl7q.jpg,"Nunc purus. Phasellus in felis. Donec semper sapien a libero. Nam dui. Proin leo odio, porttitor id, consequat in, consequat ut, nulla.",2,Quality Control Specialist
589,cmcbratneygc@bluehost.com,c7c5412a99926be2a9b4d8b2906a9f0e,ec5b298177b660f06082f6e51bcf449d5c2ff906f022b816beb5c21ffdc9c28e,Cahra,McBratney,cmcbratneygc,1994-09-20,https://i.imgur.com/0avxl7q.jpg,"Donec semper sapien a libero. Nam dui. Proin leo odio, porttitor id, consequat in, consequat ut, nulla. Sed accumsan felis. Ut at dolor quis odio consequat varius. Integer ac leo. Pellentesque ultrices mattis odio. Donec vitae nisi.",2,Web Designer III
593,asantorigg@amazon.co.uk,c7c5412a99926be2a9b4d8b2906a9f0e,ec5b298177b660f06082f6e51bcf449d5c2ff906f022b816beb5c21ffdc9c28e,Annabel,Santori,asantorigg,1990-10-02,https://i.imgur.com/0avxl7q.jpg,"Praesent lectus. Vestibulum quam sapien, varius ut, blandit non, interdum in, ante. Vestibulum ante ipsum primis in faucibus orci luctus et ultrices posuere cubilia Curae; Duis faucibus accumsan odio. Curabitur convallis. Duis consequat dui nec nisi volutpat eleifend. Donec ut dolor. Morbi vel lectus in quam fringilla rhoncus.",2,Compensation Analyst
595,jmasseogi@lulu.com,c7c5412a99926be2a9b4d8b2906a9f0e,ec5b298177b660f06082f6e51bcf449d5c2ff906f022b816beb5c21ffdc9c28e,Jessika,Masseo,jmasseogi,1958-06-16,https://i.imgur.com/0avxl7q.jpg,"Vivamus in felis eu sapien cursus vestibulum. Proin eu mi. Nulla ac enim. In tempor, turpis nec euismod scelerisque, quam turpis adipiscing lorem, vitae mattis nibh ligula nec sem. Duis aliquam convallis nunc.",2,Staff Accountant IV
597,lallpressgk@trellian.com,c7c5412a99926be2a9b4d8b2906a9f0e,ec5b298177b660f06082f6e51bcf449d5c2ff906f022b816beb5c21ffdc9c28e,Lari,Allpress,lallpressgk,1970-02-15,https://i.imgur.com/0avxl7q.jpg,"Sed sagittis. Nam congue, risus semper porta volutpat, quam pede lobortis ligula, sit amet eleifend pede libero quis orci. Nullam molestie nibh in lectus. Pellentesque at nulla. Suspendisse potenti. Cras in purus eu magna vulputate luctus. Cum sociis natoque penatibus et magnis dis parturient montes, nascetur ridiculus mus.",2,Legal Assistant
598,kkittlegl@nymag.com,c7c5412a99926be2a9b4d8b2906a9f0e,ec5b298177b660f06082f6e51bcf449d5c2ff906f022b816beb5c21ffdc9c28e,Kath,Kittle,kkittlegl,1989-12-05,https://i.imgur.com/0avxl7q.jpg,"Nulla mollis molestie lorem. Quisque ut erat. Curabitur gravida nisi at nibh. In hac habitasse platea dictumst. Aliquam augue quam, sollicitudin vitae, consectetuer eget, rutrum at, lorem. Integer tincidunt ante vel ipsum. Praesent blandit lacinia erat.",2,Structural Analysis Engineer
599,ekimmelgm@sina.com.cn,c7c5412a99926be2a9b4d8b2906a9f0e,ec5b298177b660f06082f6e51bcf449d5c2ff906f022b816beb5c21ffdc9c28e,Erinn,Kimmel,ekimmelgm,1975-12-31,https://i.imgur.com/0avxl7q.jpg,"Aliquam non mauris. Morbi non lectus. Aliquam sit amet diam in magna bibendum imperdiet. Nullam orci pede, venenatis non, sodales sed, tincidunt eu, felis. Fusce posuere felis sed lacus. Morbi sem mauris, laoreet ut, rhoncus aliquet, pulvinar sed, nisl. Nunc rhoncus dui vel sem. Sed sagittis.",2,Help Desk Operator
104,tagutter2v@illinois.edu,c7c5412a99926be2a9b4d8b2906a9f0e,ec5b298177b660f06082f6e51bcf449d5c2ff906f022b816beb5c21ffdc9c28e,Torre,Agutter,tagutter2v,1955-08-03,https://i.imgur.com/0avxl7q.jpg,Suspendisse potenti. Nullam porttitor lacus at turpis. Donec posuere metus vitae ipsum.,1,Pharmacist
607,zfranklengu@gravatar.com,c7c5412a99926be2a9b4d8b2906a9f0e,ec5b298177b660f06082f6e51bcf449d5c2ff906f022b816beb5c21ffdc9c28e,Zita,Franklen,zfranklengu,1981-10-17,https://i.imgur.com/0avxl7q.jpg,"Integer pede justo, lacinia eget, tincidunt eget, tempus vel, pede. Morbi porttitor lorem id ligula. Suspendisse ornare consequat lectus.",2,Chemical Engineer
612,efleschergz@businessinsider.com,c7c5412a99926be2a9b4d8b2906a9f0e,ec5b298177b660f06082f6e51bcf449d5c2ff906f022b816beb5c21ffdc9c28e,Emilee,Flescher,efleschergz,1968-01-29,https://i.imgur.com/0avxl7q.jpg,"Maecenas leo odio, condimentum id, luctus nec, molestie sed, justo. Pellentesque viverra pede ac diam. Cras pellentesque volutpat dui. Maecenas tristique, est et tempus semper, est quam pharetra magna, ac consequat metus sapien ut nunc. Vestibulum ante ipsum primis in faucibus orci luctus et ultrices posuere cubilia Curae; Mauris viverra diam vitae quam. Suspendisse potenti. Nullam porttitor lacus at turpis.",2,Payment Adjustment Coordinator
613,lbreah0@bluehost.com,c7c5412a99926be2a9b4d8b2906a9f0e,ec5b298177b660f06082f6e51bcf449d5c2ff906f022b816beb5c21ffdc9c28e,Latia,Brea,lbreah0,1996-12-06,https://i.imgur.com/0avxl7q.jpg,In eleifend quam a odio. In hac habitasse platea dictumst. Maecenas ut massa quis augue luctus tincidunt.,2,Senior Quality Engineer
615,ktocherh2@ezinearticles.com,c7c5412a99926be2a9b4d8b2906a9f0e,ec5b298177b660f06082f6e51bcf449d5c2ff906f022b816beb5c21ffdc9c28e,Kipp,Tocher,ktocherh2,1965-04-16,https://i.imgur.com/0avxl7q.jpg,"Pellentesque eget nunc. Donec quis orci eget orci vehicula condimentum. Curabitur in libero ut massa volutpat convallis. Morbi odio odio, elementum eu, interdum eu, tincidunt in, leo. Maecenas pulvinar lobortis est.",2,Assistant Manager
616,lashcrofth3@pcworld.com,c7c5412a99926be2a9b4d8b2906a9f0e,ec5b298177b660f06082f6e51bcf449d5c2ff906f022b816beb5c21ffdc9c28e,Leigh,Ashcroft,lashcrofth3,1989-02-25,https://i.imgur.com/0avxl7q.jpg,"Morbi vel lectus in quam fringilla rhoncus. Mauris enim leo, rhoncus sed, vestibulum sit amet, cursus id, turpis. Integer aliquet, massa id lobortis convallis, tortor risus dapibus augue, vel accumsan tellus nisi eu orci. Mauris lacinia sapien quis libero.",2,Desktop Support Technician
617,cosheildsh4@blogs.com,c7c5412a99926be2a9b4d8b2906a9f0e,ec5b298177b660f06082f6e51bcf449d5c2ff906f022b816beb5c21ffdc9c28e,Cordelia,O'Sheilds,cosheildsh4,1996-07-17,https://i.imgur.com/0avxl7q.jpg,"Duis at velit eu est congue elementum. In hac habitasse platea dictumst. Morbi vestibulum, velit id pretium iaculis, diam erat fermentum justo, nec condimentum neque sapien placerat ante. Nulla justo. Aliquam quis turpis eget elit sodales scelerisque.",2,Information Systems Manager
633,wboskellhk@wix.com,c7c5412a99926be2a9b4d8b2906a9f0e,ec5b298177b660f06082f6e51bcf449d5c2ff906f022b816beb5c21ffdc9c28e,Welby,Boskell,wboskellhk,1957-07-24,https://i.imgur.com/0avxl7q.jpg,Nullam sit amet turpis elementum ligula vehicula consequat. Morbi a ipsum. Integer a nibh. In quis justo.,1,Assistant Professor
622,lanespieh9@tinypic.com,c7c5412a99926be2a9b4d8b2906a9f0e,ec5b298177b660f06082f6e51bcf449d5c2ff906f022b816beb5c21ffdc9c28e,Lenore,Anespie,lanespieh9,1987-10-05,https://i.imgur.com/0avxl7q.jpg,"Donec diam neque, vestibulum eget, vulputate ut, ultrices vel, augue. Vestibulum ante ipsum primis in faucibus orci luctus et ultrices posuere cubilia Curae; Donec pharetra, magna vestibulum aliquet ultrices, erat tortor sollicitudin mi, sit amet lobortis sapien sapien non mi. Integer ac neque. Duis bibendum.",2,Associate Professor
623,ojoseha@purevolume.com,c7c5412a99926be2a9b4d8b2906a9f0e,ec5b298177b660f06082f6e51bcf449d5c2ff906f022b816beb5c21ffdc9c28e,Orly,Jose,ojoseha,1991-01-03,https://i.imgur.com/0avxl7q.jpg,"Fusce congue, diam id ornare imperdiet, sapien urna pretium nisl, ut volutpat sapien arcu sed augue. Aliquam erat volutpat. In congue. Etiam justo. Etiam pretium iaculis justo. In hac habitasse platea dictumst. Etiam faucibus cursus urna.",2,Civil Engineer
624,ccoganhb@vimeo.com,c7c5412a99926be2a9b4d8b2906a9f0e,ec5b298177b660f06082f6e51bcf449d5c2ff906f022b816beb5c21ffdc9c28e,Carline,Cogan,ccoganhb,1951-10-27,https://i.imgur.com/0avxl7q.jpg,"Morbi odio odio, elementum eu, interdum eu, tincidunt in, leo. Maecenas pulvinar lobortis est. Phasellus sit amet erat. Nulla tempus. Vivamus in felis eu sapien cursus vestibulum.",2,Sales Representative
629,cshippeyhg@sourceforge.net,c7c5412a99926be2a9b4d8b2906a9f0e,ec5b298177b660f06082f6e51bcf449d5c2ff906f022b816beb5c21ffdc9c28e,Correna,Shippey,cshippeyhg,1967-05-30,https://i.imgur.com/0avxl7q.jpg,"Aliquam augue quam, sollicitudin vitae, consectetuer eget, rutrum at, lorem. Integer tincidunt ante vel ipsum. Praesent blandit lacinia erat. Vestibulum sed magna at nunc commodo placerat. Praesent blandit. Nam nulla. Integer pede justo, lacinia eget, tincidunt eget, tempus vel, pede. Morbi porttitor lorem id ligula.",2,Developer IV
632,mhartnuphj@youku.com,c7c5412a99926be2a9b4d8b2906a9f0e,ec5b298177b660f06082f6e51bcf449d5c2ff906f022b816beb5c21ffdc9c28e,Marcy,Hartnup,mhartnuphj,1952-06-15,https://i.imgur.com/0avxl7q.jpg,"Integer aliquet, massa id lobortis convallis, tortor risus dapibus augue, vel accumsan tellus nisi eu orci. Mauris lacinia sapien quis libero. Nullam sit amet turpis elementum ligula vehicula consequat. Morbi a ipsum. Integer a nibh. In quis justo. Maecenas rhoncus aliquam lacus.",2,Recruiting Manager
637,hplesterho@skype.com,c7c5412a99926be2a9b4d8b2906a9f0e,ec5b298177b660f06082f6e51bcf449d5c2ff906f022b816beb5c21ffdc9c28e,Haley,Plester,hplesterho,1984-11-01,https://i.imgur.com/0avxl7q.jpg,"Morbi ut odio. Cras mi pede, malesuada in, imperdiet et, commodo vulputate, justo. In blandit ultrices enim. Lorem ipsum dolor sit amet, consectetuer adipiscing elit. Proin interdum mauris non ligula pellentesque ultrices. Phasellus id sapien in sapien iaculis congue.",2,Internal Auditor
673,gebbottsio@yandex.ru,c7c5412a99926be2a9b4d8b2906a9f0e,ec5b298177b660f06082f6e51bcf449d5c2ff906f022b816beb5c21ffdc9c28e,Gratia,Ebbotts,gebbottsio,1985-04-20,https://i.imgur.com/0avxl7q.jpg,"In hac habitasse platea dictumst. Aliquam augue quam, sollicitudin vitae, consectetuer eget, rutrum at, lorem. Integer tincidunt ante vel ipsum. Praesent blandit lacinia erat. Vestibulum sed magna at nunc commodo placerat.",2,Automation Specialist I
644,pbrushneenhv@infoseek.co.jp,c7c5412a99926be2a9b4d8b2906a9f0e,ec5b298177b660f06082f6e51bcf449d5c2ff906f022b816beb5c21ffdc9c28e,Prudence,Brushneen,pbrushneenhv,1984-02-14,https://i.imgur.com/0avxl7q.jpg,"Maecenas leo odio, condimentum id, luctus nec, molestie sed, justo. Pellentesque viverra pede ac diam. Cras pellentesque volutpat dui. Maecenas tristique, est et tempus semper, est quam pharetra magna, ac consequat metus sapien ut nunc. Vestibulum ante ipsum primis in faucibus orci luctus et ultrices posuere cubilia Curae; Mauris viverra diam vitae quam. Suspendisse potenti.",2,Budget/Accounting Analyst II
650,rleanderi1@360.cn,c7c5412a99926be2a9b4d8b2906a9f0e,ec5b298177b660f06082f6e51bcf449d5c2ff906f022b816beb5c21ffdc9c28e,Rosy,Leander,rleanderi1,1996-03-28,https://i.imgur.com/0avxl7q.jpg,"Proin interdum mauris non ligula pellentesque ultrices. Phasellus id sapien in sapien iaculis congue. Vivamus metus arcu, adipiscing molestie, hendrerit at, vulputate vitae, nisl. Aenean lectus. Pellentesque eget nunc. Donec quis orci eget orci vehicula condimentum. Curabitur in libero ut massa volutpat convallis.",2,Tax Accountant
652,owharrami3@indiatimes.com,c7c5412a99926be2a9b4d8b2906a9f0e,ec5b298177b660f06082f6e51bcf449d5c2ff906f022b816beb5c21ffdc9c28e,Oriana,Wharram,owharrami3,1971-01-16,https://i.imgur.com/0avxl7q.jpg,Mauris lacinia sapien quis libero. Nullam sit amet turpis elementum ligula vehicula consequat. Morbi a ipsum. Integer a nibh. In quis justo. Maecenas rhoncus aliquam lacus. Morbi quis tortor id nulla ultrices aliquet.,2,Teacher
654,mgeweri5@samsung.com,c7c5412a99926be2a9b4d8b2906a9f0e,ec5b298177b660f06082f6e51bcf449d5c2ff906f022b816beb5c21ffdc9c28e,Meggi,Gewer,mgeweri5,1985-08-19,https://i.imgur.com/0avxl7q.jpg,"Duis bibendum. Morbi non quam nec dui luctus rutrum. Nulla tellus. In sagittis dui vel nisl. Duis ac nibh. Fusce lacus purus, aliquet at, feugiat non, pretium quis, lectus. Suspendisse potenti. In eleifend quam a odio.",2,Nurse
656,mwillcoxi7@booking.com,c7c5412a99926be2a9b4d8b2906a9f0e,ec5b298177b660f06082f6e51bcf449d5c2ff906f022b816beb5c21ffdc9c28e,Maudie,Willcox,mwillcoxi7,1979-06-04,https://i.imgur.com/0avxl7q.jpg,"Lorem ipsum dolor sit amet, consectetuer adipiscing elit. Proin interdum mauris non ligula pellentesque ultrices. Phasellus id sapien in sapien iaculis congue. Vivamus metus arcu, adipiscing molestie, hendrerit at, vulputate vitae, nisl. Aenean lectus. Pellentesque eget nunc.",2,Sales Representative
709,hskatejo@is.gd,c7c5412a99926be2a9b4d8b2906a9f0e,ec5b298177b660f06082f6e51bcf449d5c2ff906f022b816beb5c21ffdc9c28e,Heddi,Skate,hskatejo,1951-07-17,https://i.imgur.com/0avxl7q.jpg,"Vestibulum sed magna at nunc commodo placerat. Praesent blandit. Nam nulla. Integer pede justo, lacinia eget, tincidunt eget, tempus vel, pede. Morbi porttitor lorem id ligula. Suspendisse ornare consequat lectus.",2,Assistant Professor
660,dcandishib@webs.com,c7c5412a99926be2a9b4d8b2906a9f0e,ec5b298177b660f06082f6e51bcf449d5c2ff906f022b816beb5c21ffdc9c28e,Desiri,Candish,dcandishib,1968-02-12,https://i.imgur.com/0avxl7q.jpg,"Vestibulum ante ipsum primis in faucibus orci luctus et ultrices posuere cubilia Curae; Nulla dapibus dolor vel est. Donec odio justo, sollicitudin ut, suscipit a, feugiat et, eros. Vestibulum ac est lacinia nisi venenatis tristique. Fusce congue, diam id ornare imperdiet, sapien urna pretium nisl, ut volutpat sapien arcu sed augue. Aliquam erat volutpat. In congue.",2,Registered Nurse
662,abolverid@symantec.com,c7c5412a99926be2a9b4d8b2906a9f0e,ec5b298177b660f06082f6e51bcf449d5c2ff906f022b816beb5c21ffdc9c28e,Alice,Bolver,abolverid,1964-08-27,https://i.imgur.com/0avxl7q.jpg,"Aenean fermentum. Donec ut mauris eget massa tempor convallis. Nulla neque libero, convallis eget, eleifend luctus, ultricies eu, nibh.",2,Analog Circuit Design manager
663,mjephsonie@netlog.com,c7c5412a99926be2a9b4d8b2906a9f0e,ec5b298177b660f06082f6e51bcf449d5c2ff906f022b816beb5c21ffdc9c28e,Marie,Jephson,mjephsonie,1998-01-12,https://i.imgur.com/0avxl7q.jpg,"Phasellus in felis. Donec semper sapien a libero. Nam dui. Proin leo odio, porttitor id, consequat in, consequat ut, nulla. Sed accumsan felis. Ut at dolor quis odio consequat varius.",2,Technical Writer
665,jruprechtig@bigcartel.com,c7c5412a99926be2a9b4d8b2906a9f0e,ec5b298177b660f06082f6e51bcf449d5c2ff906f022b816beb5c21ffdc9c28e,Joyann,Ruprecht,jruprechtig,1993-03-16,https://i.imgur.com/0avxl7q.jpg,"Donec semper sapien a libero. Nam dui. Proin leo odio, porttitor id, consequat in, consequat ut, nulla. Sed accumsan felis. Ut at dolor quis odio consequat varius. Integer ac leo.",2,Desktop Support Technician
669,ldurlingik@domainmarket.com,c7c5412a99926be2a9b4d8b2906a9f0e,ec5b298177b660f06082f6e51bcf449d5c2ff906f022b816beb5c21ffdc9c28e,Lacie,Durling,ldurlingik,2000-08-05,https://i.imgur.com/0avxl7q.jpg,"Vestibulum ante ipsum primis in faucibus orci luctus et ultrices posuere cubilia Curae; Nulla dapibus dolor vel est. Donec odio justo, sollicitudin ut, suscipit a, feugiat et, eros. Vestibulum ac est lacinia nisi venenatis tristique. Fusce congue, diam id ornare imperdiet, sapien urna pretium nisl, ut volutpat sapien arcu sed augue. Aliquam erat volutpat. In congue.",2,Technical Writer
676,mginnerir@cbc.ca,c7c5412a99926be2a9b4d8b2906a9f0e,ec5b298177b660f06082f6e51bcf449d5c2ff906f022b816beb5c21ffdc9c28e,Merry,Ginner,mginnerir,1981-03-07,https://i.imgur.com/0avxl7q.jpg,"Morbi porttitor lorem id ligula. Suspendisse ornare consequat lectus. In est risus, auctor sed, tristique in, tempus sit amet, sem. Fusce consequat. Nulla nisl. Nunc nisl. Duis bibendum, felis sed interdum venenatis, turpis enim blandit mi, in porttitor pede justo eu massa.",2,Research Assistant I
677,askudderis@bbb.org,c7c5412a99926be2a9b4d8b2906a9f0e,ec5b298177b660f06082f6e51bcf449d5c2ff906f022b816beb5c21ffdc9c28e,Ayn,Skudder,askudderis,1968-01-07,https://i.imgur.com/0avxl7q.jpg,"Mauris enim leo, rhoncus sed, vestibulum sit amet, cursus id, turpis. Integer aliquet, massa id lobortis convallis, tortor risus dapibus augue, vel accumsan tellus nisi eu orci. Mauris lacinia sapien quis libero. Nullam sit amet turpis elementum ligula vehicula consequat. Morbi a ipsum. Integer a nibh.",2,Senior Cost Accountant
679,dferneleyiu@cornell.edu,c7c5412a99926be2a9b4d8b2906a9f0e,ec5b298177b660f06082f6e51bcf449d5c2ff906f022b816beb5c21ffdc9c28e,Dayna,Ferneley,dferneleyiu,1951-07-24,https://i.imgur.com/0avxl7q.jpg,Sed accumsan felis. Ut at dolor quis odio consequat varius. Integer ac leo. Pellentesque ultrices mattis odio. Donec vitae nisi.,2,Community Outreach Specialist
680,jyorathiv@jugem.jp,c7c5412a99926be2a9b4d8b2906a9f0e,ec5b298177b660f06082f6e51bcf449d5c2ff906f022b816beb5c21ffdc9c28e,Jo-anne,Yorath,jyorathiv,1982-10-06,https://i.imgur.com/0avxl7q.jpg,"Vestibulum rutrum rutrum neque. Aenean auctor gravida sem. Praesent id massa id nisl venenatis lacinia. Aenean sit amet justo. Morbi ut odio. Cras mi pede, malesuada in, imperdiet et, commodo vulputate, justo. In blandit ultrices enim.",2,Marketing Assistant
681,smuncieiw@telegraph.co.uk,c7c5412a99926be2a9b4d8b2906a9f0e,ec5b298177b660f06082f6e51bcf449d5c2ff906f022b816beb5c21ffdc9c28e,Selestina,Muncie,smuncieiw,1952-06-08,https://i.imgur.com/0avxl7q.jpg,"Aliquam sit amet diam in magna bibendum imperdiet. Nullam orci pede, venenatis non, sodales sed, tincidunt eu, felis. Fusce posuere felis sed lacus. Morbi sem mauris, laoreet ut, rhoncus aliquet, pulvinar sed, nisl. Nunc rhoncus dui vel sem. Sed sagittis. Nam congue, risus semper porta volutpat, quam pede lobortis ligula, sit amet eleifend pede libero quis orci.",2,Pharmacist
682,cdeliaix@npr.org,c7c5412a99926be2a9b4d8b2906a9f0e,ec5b298177b660f06082f6e51bcf449d5c2ff906f022b816beb5c21ffdc9c28e,Callie,Delia,cdeliaix,1965-08-04,https://i.imgur.com/0avxl7q.jpg,Suspendisse potenti. In eleifend quam a odio. In hac habitasse platea dictumst. Maecenas ut massa quis augue luctus tincidunt. Nulla mollis molestie lorem.,2,Social Worker
692,llessliej7@wikia.com,c7c5412a99926be2a9b4d8b2906a9f0e,ec5b298177b660f06082f6e51bcf449d5c2ff906f022b816beb5c21ffdc9c28e,Leanora,Lesslie,llessliej7,1954-10-16,https://i.imgur.com/0avxl7q.jpg,"Vestibulum quam sapien, varius ut, blandit non, interdum in, ante. Vestibulum ante ipsum primis in faucibus orci luctus et ultrices posuere cubilia Curae; Duis faucibus accumsan odio. Curabitur convallis. Duis consequat dui nec nisi volutpat eleifend.",2,Web Designer II
693,epingstonej8@typepad.com,c7c5412a99926be2a9b4d8b2906a9f0e,ec5b298177b660f06082f6e51bcf449d5c2ff906f022b816beb5c21ffdc9c28e,Eleanor,Pingstone,epingstonej8,1970-03-14,https://i.imgur.com/0avxl7q.jpg,"Integer aliquet, massa id lobortis convallis, tortor risus dapibus augue, vel accumsan tellus nisi eu orci. Mauris lacinia sapien quis libero. Nullam sit amet turpis elementum ligula vehicula consequat.",2,Staff Accountant III
168,bwestraw4n@tmall.com,c7c5412a99926be2a9b4d8b2906a9f0e,ec5b298177b660f06082f6e51bcf449d5c2ff906f022b816beb5c21ffdc9c28e,Boris,Westraw,bwestraw4n,1989-03-15,https://i.imgur.com/0avxl7q.jpg,"In blandit ultrices enim. Lorem ipsum dolor sit amet, consectetuer adipiscing elit. Proin interdum mauris non ligula pellentesque ultrices.",1,Recruiter
695,clanghorja@tamu.edu,c7c5412a99926be2a9b4d8b2906a9f0e,ec5b298177b660f06082f6e51bcf449d5c2ff906f022b816beb5c21ffdc9c28e,Charlot,Langhor,clanghorja,1990-06-06,https://i.imgur.com/0avxl7q.jpg,"Maecenas ut massa quis augue luctus tincidunt. Nulla mollis molestie lorem. Quisque ut erat. Curabitur gravida nisi at nibh. In hac habitasse platea dictumst. Aliquam augue quam, sollicitudin vitae, consectetuer eget, rutrum at, lorem.",2,Software Consultant
696,gladleyjb@purevolume.com,c7c5412a99926be2a9b4d8b2906a9f0e,ec5b298177b660f06082f6e51bcf449d5c2ff906f022b816beb5c21ffdc9c28e,Ginevra,Ladley,gladleyjb,1953-02-03,https://i.imgur.com/0avxl7q.jpg,"Vestibulum sed magna at nunc commodo placerat. Praesent blandit. Nam nulla. Integer pede justo, lacinia eget, tincidunt eget, tempus vel, pede. Morbi porttitor lorem id ligula.",2,Librarian
698,mthreadgouldjd@php.net,c7c5412a99926be2a9b4d8b2906a9f0e,ec5b298177b660f06082f6e51bcf449d5c2ff906f022b816beb5c21ffdc9c28e,Minda,Threadgould,mthreadgouldjd,1966-09-08,https://i.imgur.com/0avxl7q.jpg,"Maecenas tincidunt lacus at velit. Vivamus vel nulla eget eros elementum pellentesque. Quisque porta volutpat erat. Quisque erat eros, viverra eget, congue eget, semper rutrum, nulla. Nunc purus.",2,Junior Executive
704,lgrimejj@fema.gov,c7c5412a99926be2a9b4d8b2906a9f0e,ec5b298177b660f06082f6e51bcf449d5c2ff906f022b816beb5c21ffdc9c28e,Lilly,Grime,lgrimejj,1973-02-21,https://i.imgur.com/0avxl7q.jpg,"Aenean sit amet justo. Morbi ut odio. Cras mi pede, malesuada in, imperdiet et, commodo vulputate, justo. In blandit ultrices enim. Lorem ipsum dolor sit amet, consectetuer adipiscing elit. Proin interdum mauris non ligula pellentesque ultrices.",2,Biostatistician III
838,nshallcrossn9@dion.ne.jp,c7c5412a99926be2a9b4d8b2906a9f0e,ec5b298177b660f06082f6e51bcf449d5c2ff906f022b816beb5c21ffdc9c28e,Nance,Shallcross,nshallcrossn9,1954-12-21,https://i.imgur.com/0avxl7q.jpg,In eleifend quam a odio. In hac habitasse platea dictumst. Maecenas ut massa quis augue luctus tincidunt. Nulla mollis molestie lorem. Quisque ut erat.,2,Assistant Professor
