id,email,password_salt,password_hashed,first_name,last_name,nickname,birthday,avatar,intro,gender,occupation
600,smabegn@opera.com,c7c5412a99926be2a9b4d8b2906a9f0e,ec5b298177b660f06082f6e51bcf449d5c2ff906f022b816beb5c21ffdc9c28e,Sigismundo,Mabe,smabegn,1988-09-09,https://i.imgur.com/0avxl7q.jpg,Nulla tempus. Vivamus in felis eu sapien cursus vestibulum. Proin eu mi.,1,Safety Technician I
47,hdivine1a@ucsd.edu,c7c5412a99926be2a9b4d8b2906a9f0e,ec5b298177b660f06082f6e51bcf449d5c2ff906f022b816beb5c21ffdc9c28e,Hastings,Divine,hdivine1a,1961-08-05,https://i.imgur.com/0avxl7q.jpg,Nullam porttitor lacus at turpis. Donec posuere metus vitae ipsum. Aliquam non mauris.,1,VP Marketing
882,eissacovoh@smh.com.au,c7c5412a99926be2a9b4d8b2906a9f0e,ec5b298177b660f06082f6e51bcf449d5c2ff906f022b816beb5c21ffdc9c28e,Eziechiele,Issacov,eissacovoh,1955-01-10,https://i.imgur.com/0avxl7q.jpg,Suspendisse accumsan tortor quis turpis. Sed ante. Vivamus tortor.,1,Financial Analyst
15,cgooderse@buzzfeed.com,c7c5412a99926be2a9b4d8b2906a9f0e,ec5b298177b660f06082f6e51bcf449d5c2ff906f022b816beb5c21ffdc9c28e,Cecelia,Gooders,cgooderse,1996-01-20,https://i.imgur.com/0avxl7q.jpg,Aenean auctor gravida sem. Praesent id massa id nisl venenatis lacinia. Aenean sit amet justo.,2,Research Associate
421,bjealousbo@smugmug.com,c7c5412a99926be2a9b4d8b2906a9f0e,ec5b298177b660f06082f6e51bcf449d5c2ff906f022b816beb5c21ffdc9c28e,Bobbie,Jealous,bjealousbo,1992-04-18,https://i.imgur.com/0avxl7q.jpg,Suspendisse potenti. Nullam porttitor lacus at turpis. Donec posuere metus vitae ipsum. Aliquam non mauris.,2,Accounting Assistant IV
448,csidneycf@rediff.com,c7c5412a99926be2a9b4d8b2906a9f0e,ec5b298177b660f06082f6e51bcf449d5c2ff906f022b816beb5c21ffdc9c28e,Corilla,Sidney,csidneycf,1977-12-25,https://i.imgur.com/0avxl7q.jpg,Suspendisse potenti. Nullam porttitor lacus at turpis. Donec posuere metus vitae ipsum.,2,Speech Pathologist
193,ccarlos5c@ucsd.edu,c7c5412a99926be2a9b4d8b2906a9f0e,ec5b298177b660f06082f6e51bcf449d5c2ff906f022b816beb5c21ffdc9c28e,Cornelle,Carlos,ccarlos5c,1952-01-29,https://i.imgur.com/0avxl7q.jpg,"Fusce posuere felis sed lacus. Morbi sem mauris, laoreet ut, rhoncus aliquet, pulvinar sed, nisl. Nunc rhoncus dui vel sem.",2,Financial Analyst
281,sstrangman7s@themeforest.net,c7c5412a99926be2a9b4d8b2906a9f0e,ec5b298177b660f06082f6e51bcf449d5c2ff906f022b816beb5c21ffdc9c28e,Selia,Strangman,sstrangman7s,1953-10-27,https://i.imgur.com/0avxl7q.jpg,"Fusce posuere felis sed lacus. Morbi sem mauris, laoreet ut, rhoncus aliquet, pulvinar sed, nisl. Nunc rhoncus dui vel sem.",2,Associate Professor
49,jtern1c@google.de,c7c5412a99926be2a9b4d8b2906a9f0e,ec5b298177b660f06082f6e51bcf449d5c2ff906f022b816beb5c21ffdc9c28e,Jamie,Tern,jtern1c,1994-08-26,https://i.imgur.com/0avxl7q.jpg,"Phasellus in felis. Donec semper sapien a libero. Nam dui. Proin leo odio, porttitor id, consequat in, consequat ut, nulla. Sed accumsan felis. Ut at dolor quis odio consequat varius.",2,Environmental Tech
2,tesposi1@instagram.com,c7c5412a99926be2a9b4d8b2906a9f0e,ec5b298177b660f06082f6e51bcf449d5c2ff906f022b816beb5c21ffdc9c28e,Toni,Esposi,tesposi1,1993-08-26,https://i.imgur.com/0avxl7q.jpg,"Curabitur gravida nisi at nibh. In hac habitasse platea dictumst. Aliquam augue quam, sollicitudin vitae, consectetuer eget, rutrum at, lorem.",2,Design Engineer
3,eimpett2@jugem.jp,c7c5412a99926be2a9b4d8b2906a9f0e,ec5b298177b660f06082f6e51bcf449d5c2ff906f022b816beb5c21ffdc9c28e,Elfrieda,Impett,eimpett2,1990-03-07,https://i.imgur.com/0avxl7q.jpg,"In est risus, auctor sed, tristique in, tempus sit amet, sem. Fusce consequat. Nulla nisl. Nunc nisl. Duis bibendum, felis sed interdum venenatis, turpis enim blandit mi, in porttitor pede justo eu massa. Donec dapibus. Duis at velit eu est congue elementum.",2,Tax Accountant
5,lsexon4@github.com,c7c5412a99926be2a9b4d8b2906a9f0e,ec5b298177b660f06082f6e51bcf449d5c2ff906f022b816beb5c21ffdc9c28e,Lynett,Sexon,lsexon4,1976-01-11,https://i.imgur.com/0avxl7q.jpg,"Nam congue, risus semper porta volutpat, quam pede lobortis ligula, sit amet eleifend pede libero quis orci. Nullam molestie nibh in lectus. Pellentesque at nulla. Suspendisse potenti.",2,Geologist IV
6,pphelip5@harvard.edu,c7c5412a99926be2a9b4d8b2906a9f0e,ec5b298177b660f06082f6e51bcf449d5c2ff906f022b816beb5c21ffdc9c28e,Pauly,Phelip,pphelip5,1991-06-07,https://i.imgur.com/0avxl7q.jpg,"Aenean auctor gravida sem. Praesent id massa id nisl venenatis lacinia. Aenean sit amet justo. Morbi ut odio. Cras mi pede, malesuada in, imperdiet et, commodo vulputate, justo. In blandit ultrices enim.",2,Technical Writer
9,prounce8@foxnews.com,c7c5412a99926be2a9b4d8b2906a9f0e,ec5b298177b660f06082f6e51bcf449d5c2ff906f022b816beb5c21ffdc9c28e,Phyllida,Rounce,prounce8,1998-09-13,https://i.imgur.com/0avxl7q.jpg,"Vivamus metus arcu, adipiscing molestie, hendrerit at, vulputate vitae, nisl. Aenean lectus. Pellentesque eget nunc. Donec quis orci eget orci vehicula condimentum. Curabitur in libero ut massa volutpat convallis. Morbi odio odio, elementum eu, interdum eu, tincidunt in, leo.",2,Executive Secretary
11,dsnasela@microsoft.com,c7c5412a99926be2a9b4d8b2906a9f0e,ec5b298177b660f06082f6e51bcf449d5c2ff906f022b816beb5c21ffdc9c28e,Deni,Snasel,dsnasela,1956-08-14,https://i.imgur.com/0avxl7q.jpg,"Proin risus. Praesent lectus. Vestibulum quam sapien, varius ut, blandit non, interdum in, ante. Vestibulum ante ipsum primis in faucibus orci luctus et ultrices posuere cubilia Curae; Duis faucibus accumsan odio. Curabitur convallis.",2,Community Outreach Specialist
12,awhaymandb@admin.ch,c7c5412a99926be2a9b4d8b2906a9f0e,ec5b298177b660f06082f6e51bcf449d5c2ff906f022b816beb5c21ffdc9c28e,Arlen,Whaymand,awhaymandb,1997-10-23,https://i.imgur.com/0avxl7q.jpg,"Fusce consequat. Nulla nisl. Nunc nisl. Duis bibendum, felis sed interdum venenatis, turpis enim blandit mi, in porttitor pede justo eu massa.",2,Accountant I
14,ssholemd@xrea.com,c7c5412a99926be2a9b4d8b2906a9f0e,ec5b298177b660f06082f6e51bcf449d5c2ff906f022b816beb5c21ffdc9c28e,Shela,Sholem,ssholemd,1972-07-06,https://i.imgur.com/0avxl7q.jpg,"Proin interdum mauris non ligula pellentesque ultrices. Phasellus id sapien in sapien iaculis congue. Vivamus metus arcu, adipiscing molestie, hendrerit at, vulputate vitae, nisl. Aenean lectus. Pellentesque eget nunc. Donec quis orci eget orci vehicula condimentum.",2,Health Coach I
16,aturmallf@boston.com,c7c5412a99926be2a9b4d8b2906a9f0e,ec5b298177b660f06082f6e51bcf449d5c2ff906f022b816beb5c21ffdc9c28e,Analise,Turmall,aturmallf,1990-05-29,https://i.imgur.com/0avxl7q.jpg,"Nulla tempus. Vivamus in felis eu sapien cursus vestibulum. Proin eu mi. Nulla ac enim. In tempor, turpis nec euismod scelerisque, quam turpis adipiscing lorem, vitae mattis nibh ligula nec sem. Duis aliquam convallis nunc. Proin at turpis a pede posuere nonummy. Integer non velit.",2,Account Representative II
17,vfortoung@spotify.com,c7c5412a99926be2a9b4d8b2906a9f0e,ec5b298177b660f06082f6e51bcf449d5c2ff906f022b816beb5c21ffdc9c28e,Vanessa,Fortoun,vfortoung,1997-05-25,https://i.imgur.com/0avxl7q.jpg,"Integer pede justo, lacinia eget, tincidunt eget, tempus vel, pede. Morbi porttitor lorem id ligula. Suspendisse ornare consequat lectus. In est risus, auctor sed, tristique in, tempus sit amet, sem.",2,Software Engineer IV
18,rblofeldh@google.co.jp,c7c5412a99926be2a9b4d8b2906a9f0e,ec5b298177b660f06082f6e51bcf449d5c2ff906f022b816beb5c21ffdc9c28e,Ronnie,Blofeld,rblofeldh,1954-09-24,https://i.imgur.com/0avxl7q.jpg,Praesent blandit lacinia erat. Vestibulum sed magna at nunc commodo placerat. Praesent blandit.,2,VP Marketing
28,ebarger@thetimes.co.uk,c7c5412a99926be2a9b4d8b2906a9f0e,ec5b298177b660f06082f6e51bcf449d5c2ff906f022b816beb5c21ffdc9c28e,Eveleen,Barge,ebarger,1970-08-30,https://i.imgur.com/0avxl7q.jpg,Etiam faucibus cursus urna. Ut tellus. Nulla ut erat id mauris vulputate elementum.,2,Statistician I
30,fsalandinot@elegantthemes.com,c7c5412a99926be2a9b4d8b2906a9f0e,ec5b298177b660f06082f6e51bcf449d5c2ff906f022b816beb5c21ffdc9c28e,Flora,Salandino,fsalandinot,1994-12-15,https://i.imgur.com/0avxl7q.jpg,"Aenean sit amet justo. Morbi ut odio. Cras mi pede, malesuada in, imperdiet et, commodo vulputate, justo. In blandit ultrices enim.",2,Marketing Assistant
31,lgibbinsu@biglobe.ne.jp,c7c5412a99926be2a9b4d8b2906a9f0e,ec5b298177b660f06082f6e51bcf449d5c2ff906f022b816beb5c21ffdc9c28e,Lesli,Gibbins,lgibbinsu,1957-01-29,https://i.imgur.com/0avxl7q.jpg,"Curabitur in libero ut massa volutpat convallis. Morbi odio odio, elementum eu, interdum eu, tincidunt in, leo. Maecenas pulvinar lobortis est. Phasellus sit amet erat. Nulla tempus. Vivamus in felis eu sapien cursus vestibulum. Proin eu mi.",2,Web Designer II
225,ioleszcuk68@go.com,c7c5412a99926be2a9b4d8b2906a9f0e,ec5b298177b660f06082f6e51bcf449d5c2ff906f022b816beb5c21ffdc9c28e,Isahella,Oleszcuk,ioleszcuk68,1968-11-03,https://i.imgur.com/0avxl7q.jpg,Aliquam erat volutpat. In congue. Etiam justo.,2,VP Quality Control
33,lcressorw@fotki.com,c7c5412a99926be2a9b4d8b2906a9f0e,ec5b298177b660f06082f6e51bcf449d5c2ff906f022b816beb5c21ffdc9c28e,Lorettalorna,Cressor,lcressorw,1956-09-10,https://i.imgur.com/0avxl7q.jpg,"Proin at turpis a pede posuere nonummy. Integer non velit. Donec diam neque, vestibulum eget, vulputate ut, ultrices vel, augue. Vestibulum ante ipsum primis in faucibus orci luctus et ultrices posuere cubilia Curae; Donec pharetra, magna vestibulum aliquet ultrices, erat tortor sollicitudin mi, sit amet lobortis sapien sapien non mi.",2,Staff Accountant II
34,sbateripx@dailymail.co.uk,c7c5412a99926be2a9b4d8b2906a9f0e,ec5b298177b660f06082f6e51bcf449d5c2ff906f022b816beb5c21ffdc9c28e,Shelagh,Baterip,sbateripx,1976-06-24,https://i.imgur.com/0avxl7q.jpg,"Integer a nibh. In quis justo. Maecenas rhoncus aliquam lacus. Morbi quis tortor id nulla ultrices aliquet. Maecenas leo odio, condimentum id, luctus nec, molestie sed, justo. Pellentesque viverra pede ac diam.",2,Environmental Specialist
35,bstegelly@ycombinator.com,c7c5412a99926be2a9b4d8b2906a9f0e,ec5b298177b660f06082f6e51bcf449d5c2ff906f022b816beb5c21ffdc9c28e,Bonnibelle,Stegell,bstegelly,1995-01-07,https://i.imgur.com/0avxl7q.jpg,"Duis ac nibh. Fusce lacus purus, aliquet at, feugiat non, pretium quis, lectus. Suspendisse potenti. In eleifend quam a odio. In hac habitasse platea dictumst. Maecenas ut massa quis augue luctus tincidunt. Nulla mollis molestie lorem. Quisque ut erat.",2,Programmer I
38,kinns11@moonfruit.com,c7c5412a99926be2a9b4d8b2906a9f0e,ec5b298177b660f06082f6e51bcf449d5c2ff906f022b816beb5c21ffdc9c28e,Kristien,Inns,kinns11,1999-08-01,https://i.imgur.com/0avxl7q.jpg,"Quisque ut erat. Curabitur gravida nisi at nibh. In hac habitasse platea dictumst. Aliquam augue quam, sollicitudin vitae, consectetuer eget, rutrum at, lorem. Integer tincidunt ante vel ipsum. Praesent blandit lacinia erat. Vestibulum sed magna at nunc commodo placerat.",2,Structural Engineer
48,lveal1b@a8.net,c7c5412a99926be2a9b4d8b2906a9f0e,ec5b298177b660f06082f6e51bcf449d5c2ff906f022b816beb5c21ffdc9c28e,Lina,Veal,lveal1b,1984-09-21,https://i.imgur.com/0avxl7q.jpg,"Pellentesque ultrices mattis odio. Donec vitae nisi. Nam ultrices, libero non mattis pulvinar, nulla pede ullamcorper augue, a suscipit nulla elit ac nulla. Sed vel enim sit amet nunc viverra dapibus. Nulla suscipit ligula in lacus. Curabitur at ipsum ac tellus semper interdum. Mauris ullamcorper purus sit amet nulla. Quisque arcu libero, rutrum ac, lobortis vel, dapibus at, diam.",2,Account Coordinator
54,rlaurent1h@google.it,c7c5412a99926be2a9b4d8b2906a9f0e,ec5b298177b660f06082f6e51bcf449d5c2ff906f022b816beb5c21ffdc9c28e,Ruthann,Laurent,rlaurent1h,1957-04-24,https://i.imgur.com/0avxl7q.jpg,Maecenas pulvinar lobortis est. Phasellus sit amet erat. Nulla tempus.,2,Speech Pathologist
55,jcasier1i@pagesperso-orange.fr,c7c5412a99926be2a9b4d8b2906a9f0e,ec5b298177b660f06082f6e51bcf449d5c2ff906f022b816beb5c21ffdc9c28e,Jerry,Casier,jcasier1i,1990-03-05,https://i.imgur.com/0avxl7q.jpg,"Integer tincidunt ante vel ipsum. Praesent blandit lacinia erat. Vestibulum sed magna at nunc commodo placerat. Praesent blandit. Nam nulla. Integer pede justo, lacinia eget, tincidunt eget, tempus vel, pede. Morbi porttitor lorem id ligula. Suspendisse ornare consequat lectus.",2,Human Resources Manager
56,ksimmank1j@youtu.be,c7c5412a99926be2a9b4d8b2906a9f0e,ec5b298177b660f06082f6e51bcf449d5c2ff906f022b816beb5c21ffdc9c28e,Kizzee,Simmank,ksimmank1j,1952-01-02,https://i.imgur.com/0avxl7q.jpg,"Nunc purus. Phasellus in felis. Donec semper sapien a libero. Nam dui. Proin leo odio, porttitor id, consequat in, consequat ut, nulla. Sed accumsan felis. Ut at dolor quis odio consequat varius. Integer ac leo.",2,Tax Accountant
58,rmilburn1l@home.pl,c7c5412a99926be2a9b4d8b2906a9f0e,ec5b298177b660f06082f6e51bcf449d5c2ff906f022b816beb5c21ffdc9c28e,Rosalind,Milburn,rmilburn1l,1988-03-20,https://i.imgur.com/0avxl7q.jpg,"Nullam porttitor lacus at turpis. Donec posuere metus vitae ipsum. Aliquam non mauris. Morbi non lectus. Aliquam sit amet diam in magna bibendum imperdiet. Nullam orci pede, venenatis non, sodales sed, tincidunt eu, felis. Fusce posuere felis sed lacus. Morbi sem mauris, laoreet ut, rhoncus aliquet, pulvinar sed, nisl.",2,Senior Quality Engineer
59,dhyndley1m@blinklist.com,c7c5412a99926be2a9b4d8b2906a9f0e,ec5b298177b660f06082f6e51bcf449d5c2ff906f022b816beb5c21ffdc9c28e,Dasie,Hyndley,dhyndley1m,1990-01-03,https://i.imgur.com/0avxl7q.jpg,"Integer pede justo, lacinia eget, tincidunt eget, tempus vel, pede. Morbi porttitor lorem id ligula. Suspendisse ornare consequat lectus. In est risus, auctor sed, tristique in, tempus sit amet, sem. Fusce consequat.",2,Programmer I
60,cperocci1n@phpbb.com,c7c5412a99926be2a9b4d8b2906a9f0e,ec5b298177b660f06082f6e51bcf449d5c2ff906f022b816beb5c21ffdc9c28e,Cybill,Perocci,cperocci1n,1964-09-21,https://i.imgur.com/0avxl7q.jpg,Etiam justo. Etiam pretium iaculis justo. In hac habitasse platea dictumst.,2,Speech Pathologist
61,vschwandermann1o@webeden.co.uk,c7c5412a99926be2a9b4d8b2906a9f0e,ec5b298177b660f06082f6e51bcf449d5c2ff906f022b816beb5c21ffdc9c28e,Veradis,Schwandermann,vschwandermann1o,1975-01-16,https://i.imgur.com/0avxl7q.jpg,"In hac habitasse platea dictumst. Morbi vestibulum, velit id pretium iaculis, diam erat fermentum justo, nec condimentum neque sapien placerat ante. Nulla justo. Aliquam quis turpis eget elit sodales scelerisque.",2,Automation Specialist II
66,dcrohan1t@xrea.com,c7c5412a99926be2a9b4d8b2906a9f0e,ec5b298177b660f06082f6e51bcf449d5c2ff906f022b816beb5c21ffdc9c28e,Domini,Crohan,dcrohan1t,1998-07-07,https://i.imgur.com/0avxl7q.jpg,"Morbi ut odio. Cras mi pede, malesuada in, imperdiet et, commodo vulputate, justo. In blandit ultrices enim. Lorem ipsum dolor sit amet, consectetuer adipiscing elit. Proin interdum mauris non ligula pellentesque ultrices. Phasellus id sapien in sapien iaculis congue. Vivamus metus arcu, adipiscing molestie, hendrerit at, vulputate vitae, nisl.",2,Structural Analysis Engineer
67,dedler1u@ucla.edu,c7c5412a99926be2a9b4d8b2906a9f0e,ec5b298177b660f06082f6e51bcf449d5c2ff906f022b816beb5c21ffdc9c28e,Dede,Edler,dedler1u,1995-06-07,https://i.imgur.com/0avxl7q.jpg,Etiam vel augue. Vestibulum rutrum rutrum neque. Aenean auctor gravida sem. Praesent id massa id nisl venenatis lacinia. Aenean sit amet justo.,2,Senior Sales Associate
69,atite1w@home.pl,c7c5412a99926be2a9b4d8b2906a9f0e,ec5b298177b660f06082f6e51bcf449d5c2ff906f022b816beb5c21ffdc9c28e,Alice,Tite,atite1w,1976-03-12,https://i.imgur.com/0avxl7q.jpg,Etiam pretium iaculis justo. In hac habitasse platea dictumst. Etiam faucibus cursus urna. Ut tellus. Nulla ut erat id mauris vulputate elementum. Nullam varius. Nulla facilisi. Cras non velit nec nisi vulputate nonummy.,2,Marketing Manager
70,hharbron1x@chronoengine.com,c7c5412a99926be2a9b4d8b2906a9f0e,ec5b298177b660f06082f6e51bcf449d5c2ff906f022b816beb5c21ffdc9c28e,Hyacintha,Harbron,hharbron1x,1994-06-22,https://i.imgur.com/0avxl7q.jpg,"Duis aliquam convallis nunc. Proin at turpis a pede posuere nonummy. Integer non velit. Donec diam neque, vestibulum eget, vulputate ut, ultrices vel, augue. Vestibulum ante ipsum primis in faucibus orci luctus et ultrices posuere cubilia Curae; Donec pharetra, magna vestibulum aliquet ultrices, erat tortor sollicitudin mi, sit amet lobortis sapien sapien non mi. Integer ac neque.",2,Executive Secretary
84,fmaccrossan2b@sciencedirect.com,c7c5412a99926be2a9b4d8b2906a9f0e,ec5b298177b660f06082f6e51bcf449d5c2ff906f022b816beb5c21ffdc9c28e,Florina,MacCrossan,fmaccrossan2b,1991-04-12,https://i.imgur.com/0avxl7q.jpg,"Pellentesque eget nunc. Donec quis orci eget orci vehicula condimentum. Curabitur in libero ut massa volutpat convallis. Morbi odio odio, elementum eu, interdum eu, tincidunt in, leo. Maecenas pulvinar lobortis est. Phasellus sit amet erat. Nulla tempus. Vivamus in felis eu sapien cursus vestibulum.",2,GIS Technical Architect
101,bbalnaves2s@homestead.com,c7c5412a99926be2a9b4d8b2906a9f0e,ec5b298177b660f06082f6e51bcf449d5c2ff906f022b816beb5c21ffdc9c28e,Brett,Balnaves,bbalnaves2s,1976-07-24,https://i.imgur.com/0avxl7q.jpg,"Maecenas tincidunt lacus at velit. Vivamus vel nulla eget eros elementum pellentesque. Quisque porta volutpat erat. Quisque erat eros, viverra eget, congue eget, semper rutrum, nulla. Nunc purus. Phasellus in felis.",2,Technical Writer
85,rmazzia2c@prweb.com,c7c5412a99926be2a9b4d8b2906a9f0e,ec5b298177b660f06082f6e51bcf449d5c2ff906f022b816beb5c21ffdc9c28e,Rosie,Mazzia,rmazzia2c,1956-01-04,https://i.imgur.com/0avxl7q.jpg,"Cras pellentesque volutpat dui. Maecenas tristique, est et tempus semper, est quam pharetra magna, ac consequat metus sapien ut nunc. Vestibulum ante ipsum primis in faucibus orci luctus et ultrices posuere cubilia Curae; Mauris viverra diam vitae quam. Suspendisse potenti. Nullam porttitor lacus at turpis. Donec posuere metus vitae ipsum. Aliquam non mauris.",2,Software Test Engineer I
88,cdemullett2f@google.it,c7c5412a99926be2a9b4d8b2906a9f0e,ec5b298177b660f06082f6e51bcf449d5c2ff906f022b816beb5c21ffdc9c28e,Cecilia,de Mullett,cdemullett2f,1953-12-16,https://i.imgur.com/0avxl7q.jpg,Aliquam erat volutpat. In congue. Etiam justo. Etiam pretium iaculis justo. In hac habitasse platea dictumst. Etiam faucibus cursus urna.,2,Analyst Programmer
118,hassinder39@amazon.de,c7c5412a99926be2a9b4d8b2906a9f0e,ec5b298177b660f06082f6e51bcf449d5c2ff906f022b816beb5c21ffdc9c28e,Harmonia,Assinder,hassinder39,1984-08-02,https://i.imgur.com/0avxl7q.jpg,"Morbi odio odio, elementum eu, interdum eu, tincidunt in, leo. Maecenas pulvinar lobortis est. Phasellus sit amet erat. Nulla tempus.",2,Recruiting Manager
94,bpresnall2l@discovery.com,c7c5412a99926be2a9b4d8b2906a9f0e,ec5b298177b660f06082f6e51bcf449d5c2ff906f022b816beb5c21ffdc9c28e,Bryn,Presnall,bpresnall2l,1971-07-23,https://i.imgur.com/0avxl7q.jpg,"Curabitur gravida nisi at nibh. In hac habitasse platea dictumst. Aliquam augue quam, sollicitudin vitae, consectetuer eget, rutrum at, lorem. Integer tincidunt ante vel ipsum. Praesent blandit lacinia erat.",2,Senior Editor
178,mbackwell4x@usda.gov,c7c5412a99926be2a9b4d8b2906a9f0e,ec5b298177b660f06082f6e51bcf449d5c2ff906f022b816beb5c21ffdc9c28e,Mercie,Backwell,mbackwell4x,1956-12-22,https://i.imgur.com/0avxl7q.jpg,Sed accumsan felis. Ut at dolor quis odio consequat varius. Integer ac leo.,2,Research Assistant II
105,sbeernaert2w@edublogs.org,c7c5412a99926be2a9b4d8b2906a9f0e,ec5b298177b660f06082f6e51bcf449d5c2ff906f022b816beb5c21ffdc9c28e,Stace,Beernaert,sbeernaert2w,1965-03-30,https://i.imgur.com/0avxl7q.jpg,"Donec semper sapien a libero. Nam dui. Proin leo odio, porttitor id, consequat in, consequat ut, nulla. Sed accumsan felis. Ut at dolor quis odio consequat varius. Integer ac leo. Pellentesque ultrices mattis odio. Donec vitae nisi.",2,Software Engineer I
108,cedrich2z@goo.ne.jp,c7c5412a99926be2a9b4d8b2906a9f0e,ec5b298177b660f06082f6e51bcf449d5c2ff906f022b816beb5c21ffdc9c28e,Chiquita,Edrich,cedrich2z,1997-12-29,https://i.imgur.com/0avxl7q.jpg,Aliquam quis turpis eget elit sodales scelerisque. Mauris sit amet eros. Suspendisse accumsan tortor quis turpis. Sed ante. Vivamus tortor.,2,Chief Design Engineer
109,rcolumbell30@goodreads.com,c7c5412a99926be2a9b4d8b2906a9f0e,ec5b298177b660f06082f6e51bcf449d5c2ff906f022b816beb5c21ffdc9c28e,Rosamund,Columbell,rcolumbell30,1991-05-23,https://i.imgur.com/0avxl7q.jpg,Aliquam quis turpis eget elit sodales scelerisque. Mauris sit amet eros. Suspendisse accumsan tortor quis turpis.,2,Internal Auditor
114,llocock35@ft.com,c7c5412a99926be2a9b4d8b2906a9f0e,ec5b298177b660f06082f6e51bcf449d5c2ff906f022b816beb5c21ffdc9c28e,Lane,Locock,llocock35,1980-06-26,https://i.imgur.com/0avxl7q.jpg,"Nunc purus. Phasellus in felis. Donec semper sapien a libero. Nam dui. Proin leo odio, porttitor id, consequat in, consequat ut, nulla. Sed accumsan felis. Ut at dolor quis odio consequat varius.",2,Electrical Engineer
115,mcadge36@pcworld.com,c7c5412a99926be2a9b4d8b2906a9f0e,ec5b298177b660f06082f6e51bcf449d5c2ff906f022b816beb5c21ffdc9c28e,Mureil,Cadge,mcadge36,1967-09-18,https://i.imgur.com/0avxl7q.jpg,"Donec odio justo, sollicitudin ut, suscipit a, feugiat et, eros. Vestibulum ac est lacinia nisi venenatis tristique. Fusce congue, diam id ornare imperdiet, sapien urna pretium nisl, ut volutpat sapien arcu sed augue. Aliquam erat volutpat. In congue.",2,Occupational Therapist
117,olindborg38@vistaprint.com,c7c5412a99926be2a9b4d8b2906a9f0e,ec5b298177b660f06082f6e51bcf449d5c2ff906f022b816beb5c21ffdc9c28e,Orelee,Lindborg,olindborg38,1951-12-29,https://i.imgur.com/0avxl7q.jpg,"Fusce congue, diam id ornare imperdiet, sapien urna pretium nisl, ut volutpat sapien arcu sed augue. Aliquam erat volutpat. In congue. Etiam justo. Etiam pretium iaculis justo. In hac habitasse platea dictumst. Etiam faucibus cursus urna. Ut tellus.",2,Dental Hygienist
120,sbebb3b@flickr.com,c7c5412a99926be2a9b4d8b2906a9f0e,ec5b298177b660f06082f6e51bcf449d5c2ff906f022b816beb5c21ffdc9c28e,Selie,Bebb,sbebb3b,1970-04-24,https://i.imgur.com/0avxl7q.jpg,"Morbi ut odio. Cras mi pede, malesuada in, imperdiet et, commodo vulputate, justo. In blandit ultrices enim. Lorem ipsum dolor sit amet, consectetuer adipiscing elit. Proin interdum mauris non ligula pellentesque ultrices. Phasellus id sapien in sapien iaculis congue. Vivamus metus arcu, adipiscing molestie, hendrerit at, vulputate vitae, nisl.",2,Director of Sales
121,nlycett3c@theglobeandmail.com,c7c5412a99926be2a9b4d8b2906a9f0e,ec5b298177b660f06082f6e51bcf449d5c2ff906f022b816beb5c21ffdc9c28e,Nelly,Lycett,nlycett3c,1986-06-18,https://i.imgur.com/0avxl7q.jpg,"Phasellus id sapien in sapien iaculis congue. Vivamus metus arcu, adipiscing molestie, hendrerit at, vulputate vitae, nisl. Aenean lectus.",2,Marketing Assistant
122,ncotelard3d@51.la,c7c5412a99926be2a9b4d8b2906a9f0e,ec5b298177b660f06082f6e51bcf449d5c2ff906f022b816beb5c21ffdc9c28e,Netta,Cotelard,ncotelard3d,1959-04-21,https://i.imgur.com/0avxl7q.jpg,Etiam justo. Etiam pretium iaculis justo. In hac habitasse platea dictumst. Etiam faucibus cursus urna. Ut tellus. Nulla ut erat id mauris vulputate elementum. Nullam varius. Nulla facilisi.,2,Marketing Assistant
124,sbamber3f@cnn.com,c7c5412a99926be2a9b4d8b2906a9f0e,ec5b298177b660f06082f6e51bcf449d5c2ff906f022b816beb5c21ffdc9c28e,Sherline,Bamber,sbamber3f,1965-08-15,https://i.imgur.com/0avxl7q.jpg,Morbi a ipsum. Integer a nibh. In quis justo. Maecenas rhoncus aliquam lacus. Morbi quis tortor id nulla ultrices aliquet.,2,Sales Associate
125,manmore3g@privacy.gov.au,c7c5412a99926be2a9b4d8b2906a9f0e,ec5b298177b660f06082f6e51bcf449d5c2ff906f022b816beb5c21ffdc9c28e,Millicent,Anmore,manmore3g,1964-10-13,https://i.imgur.com/0avxl7q.jpg,"Morbi quis tortor id nulla ultrices aliquet. Maecenas leo odio, condimentum id, luctus nec, molestie sed, justo. Pellentesque viverra pede ac diam. Cras pellentesque volutpat dui. Maecenas tristique, est et tempus semper, est quam pharetra magna, ac consequat metus sapien ut nunc. Vestibulum ante ipsum primis in faucibus orci luctus et ultrices posuere cubilia Curae; Mauris viverra diam vitae quam.",2,Executive Secretary
127,rsarfati3i@cyberchimps.com,c7c5412a99926be2a9b4d8b2906a9f0e,ec5b298177b660f06082f6e51bcf449d5c2ff906f022b816beb5c21ffdc9c28e,Rivalee,Sarfati,rsarfati3i,1961-05-02,https://i.imgur.com/0avxl7q.jpg,"Morbi odio odio, elementum eu, interdum eu, tincidunt in, leo. Maecenas pulvinar lobortis est. Phasellus sit amet erat. Nulla tempus.",2,Mechanical Systems Engineer
139,gphilipot3u@github.com,c7c5412a99926be2a9b4d8b2906a9f0e,ec5b298177b660f06082f6e51bcf449d5c2ff906f022b816beb5c21ffdc9c28e,Glen,Philipot,gphilipot3u,1995-09-30,https://i.imgur.com/0avxl7q.jpg,Morbi non quam nec dui luctus rutrum. Nulla tellus. In sagittis dui vel nisl. Duis ac nibh.,2,Assistant Professor
140,lsirmond3v@booking.com,c7c5412a99926be2a9b4d8b2906a9f0e,ec5b298177b660f06082f6e51bcf449d5c2ff906f022b816beb5c21ffdc9c28e,Lorrin,Sirmond,lsirmond3v,1952-11-27,https://i.imgur.com/0avxl7q.jpg,"Quisque ut erat. Curabitur gravida nisi at nibh. In hac habitasse platea dictumst. Aliquam augue quam, sollicitudin vitae, consectetuer eget, rutrum at, lorem. Integer tincidunt ante vel ipsum. Praesent blandit lacinia erat. Vestibulum sed magna at nunc commodo placerat.",2,Financial Analyst
144,aissit3z@fema.gov,c7c5412a99926be2a9b4d8b2906a9f0e,ec5b298177b660f06082f6e51bcf449d5c2ff906f022b816beb5c21ffdc9c28e,Ada,Issit,aissit3z,1953-03-13,https://i.imgur.com/0avxl7q.jpg,"Lorem ipsum dolor sit amet, consectetuer adipiscing elit. Proin risus. Praesent lectus.",2,Analyst Programmer
